"Post Unique Reference","Name","Grade (or equivalent)","Job Title","Job/Team Function","Parent Department","Organisation","Unit","Contact Phone","Contact E-mail","Reports to Senior Post","Salary Cost of Reports (£)","FTE","Actual Pay Floor (£)","Actual Pay Ceiling (£)","","Professional/Occupational Group","Notes","Valid?","URI","source_file","source_line"
"CAFCASS-1009","Charlotte McCafferty","SCS2","Director of Legal Services","Responsible for the in-house legal service including all aspects of family law and civil law and corporate law","Department for Education","Children and Family Court Advisory and Support Service","Legal","0844 353 3350","Charlotte.McCafferty@cafcass.gsi.gov.uk","CAFCASS-1002","634954","1","110000","114999","","Law","","","http://reference.data.gov.uk/id/public-body/children-and-family-court-advisory-and-support-ser/post/CAFCASS-1009","/data/cafcass/2011-03-31/Test-government-staff-and-salary-data-blank-template-March-2011.1.xls","person7"
"CAFCASS-1005","Julie Brown","SCS2","Director of Finance","Responsible for developing financial strategies and policies and infrastructure for CAFCASS. Lead the budget strategy and resource allocation across CAFCASS. Also responsible for Risk Management/Procurement/Business Planning/Business Continuity.","Department for Education","Children and Family Court Advisory and Support Service","Finance","0844 353 3350","Julie.Brown@cafcass.gsi.gov.uk","CAFCASS-1002","1172456","1","110000","114999","","Finance","","","http://reference.data.gov.uk/id/public-body/children-and-family-court-advisory-and-support-ser/post/CAFCASS-1005","/data/cafcass/2011-03-31/Test-government-staff-and-salary-data-blank-template-March-2011.1.xls","person4"
"CAFCASS-1007","Darren Scates","SCS2","Director of Business Transformation and Technology (and CIO)","To lead on Cafcass achieving its business transformation objectives by delivering a secure and robust IT and infrastructure service for the whole organisation and providing reliable IT support services via a Shared Services framework in line with the Transformational Government agenda and Cafcass business plans.","Department for Education","Children and Family Court Advisory and Support Service","IT/BT","0844 353 3350","Darren.Scates@cafcass.gsi.gov.uk","CAFCASS-1002","643226","1","110000","114999","","Information Technology","","","http://reference.data.gov.uk/id/public-body/children-and-family-court-advisory-and-support-ser/post/CAFCASS-1007","/data/cafcass/2011-03-31/Test-government-staff-and-salary-data-blank-template-March-2011.1.xls","person6"
"CAFCASS-1003","Christine Banim","SCS2","Operational Director","Leadership and management of Cafcass teams and services covering a large geographical area including a range of urban and rural communities.","Department for Education","Children and Family Court Advisory and Support Service","Central Operations","0844 353 3350","Christine.Banim@cafcass.gsi.gov.uk","CAFCASS-1002","28855207","1","115000","119999","","Operational Delivery","","","http://reference.data.gov.uk/id/public-body/children-and-family-court-advisory-and-support-ser/post/CAFCASS-1003","/data/cafcass/2011-03-31/Test-government-staff-and-salary-data-blank-template-March-2011.1.xls","person3"
"CAFCASS-1014","Vincent Clark","SCS2","Operational Director","Leadership and management of Cafcass teams and services covering a large geographical area including a range of urban and rural communities.","Department for Education","Children and Family Court Advisory and Support Service","South Operations","0844 353 3350","Vince.Clark@cafcass.gsi.gov.uk","CAFCASS-1002","36088638","1","115000","119999","","Operational Delivery","","","http://reference.data.gov.uk/id/public-body/children-and-family-court-advisory-and-support-ser/post/CAFCASS-1014","/data/cafcass/2011-03-31/Test-government-staff-and-salary-data-blank-template-March-2011.1.xls","person10"
"CAFCASS-1010","Darren Shaw","SCS2","Operational Director","Leadership and management of Cafcass teams and services covering a large geographical area including a range of urban and rural communities.","Department for Education","Children and Family Court Advisory and Support Service","North Operations","0844 353 3350","Darren.Shaw@cafcass.gsi.gov.uk","CAFCASS-1002","27257482","1","115000","119999","","Operational Delivery","","","http://reference.data.gov.uk/id/public-body/children-and-family-court-advisory-and-support-ser/post/CAFCASS-1010","/data/cafcass/2011-03-31/Test-government-staff-and-salary-data-blank-template-March-2011.1.xls","person8"
"CAFCASS-1011","Bruce Clark","SCS2","Director of Policy","To lead and provide expert strategic advice and support to the Chief Executive and senior managers and the Cafcass Board on major policy development issues affecting the future direction of services across the whole of Cafcass.","Department for Education","Children and Family Court Advisory and Support Service","Policy","0844 353 3350","Bruce.Clark@cafcass.gsi.gov.uk","CAFCASS-1002","2271836","1","115000","119999","","Policy","","","http://reference.data.gov.uk/id/public-body/children-and-family-court-advisory-and-support-ser/post/CAFCASS-1011","/data/cafcass/2011-03-31/Test-government-staff-and-salary-data-blank-template-March-2011.1.xls","person9"
"CAFCASS-1006","Jabbar Sardar","SCS2","Director of Human Resources and Organisational Development","Responsible for design and delivery of employment practices and workforce strategies and Organisational development aligned to the corporate objectives.","Department for Education","Children and Family Court Advisory and Support Service","Human Resources","0844 353 3350","Jabbar.Sardar@cafcass.gsi.gov.uk","CAFCASS-1002","1803160","1","115000","119999","","Human Resources","","","http://reference.data.gov.uk/id/public-body/children-and-family-court-advisory-and-support-ser/post/CAFCASS-1006","/data/cafcass/2011-03-31/Test-government-staff-and-salary-data-blank-template-March-2011.1.xls","person5"
"CAFCASS-1002","Anthony Douglas","SCS4","Chief Executive","Responsible for providing strategic and operational leadership to the organisation and �ensuring a good quality service is received by children families and courts and that the organisation is well managed.","Department for Education","Children and Family Court Advisory and Support Service","Chief Executive's Office","0844 353 3350","Anthony.Douglas@cafcass.gsi.gov.uk","XX","559308","1","160000","164999","","Planning","","","http://reference.data.gov.uk/id/public-body/children-and-family-court-advisory-and-support-ser/post/CAFCASS-1002","/data/cafcass/2011-03-31/Test-government-staff-and-salary-data-blank-template-March-2011.1.xls","person2"
