"Post Unique Reference","Name","Grade (or equivalent)","Job Title","Job/Team Function","Parent Department","Organisation","Unit","Contact Phone","Contact E-mail","Reports to Senior Post","Salary Cost of Reports (£)","FTE","Actual Pay Floor (£)","Actual Pay Ceiling (£)","","Professional/Occupational Group","Notes","Valid?","URI","source_file","source_line"
"5","Simon McKinnon","SCS2","Information and Technology Director","The Information and Technology Directorate is responsible for ensuring that the Commissions current and future Information Technology and Information Management needs are met. The Directorate provides local IT support, telephony services, and operational support for the Commission's current business applications. The Directorate is also supporting the Commissions change programme, building with third parties a range of applications for the new child maintenance scheme. In addition, the directorate provides information assurance and IT security services to protect information and systems within the Commission.","Department for Work and Pensions","Child Maintenance and Enforcement Commission","Information and Technology Directorate","0207 853 8012","transparency.questions@childmaintenance.gsi.gov.uk","1","0","1","125000","129999","","Information Technology","","","http://reference.data.gov.uk/id/public-body/child-maintenance-and-enforcement-commission/post/5","/data/childmaintenance/2011-09-30/Template---Final.xls","person5"
"4","Ian Wright","SCS2","Change Director","The Change Directorate leads the implementation of major change projects, ensuring that projects are delivered to time and to budget.","Department for Work and Pensions","Child Maintenance and Enforcement Commission","Change Directorate","0207 853 8012","transparency.questions@childmaintenance.gsi.gov.uk","1","2263014","1","115000","119999","","Programme and Project Management (PPM)","","","http://reference.data.gov.uk/id/public-body/child-maintenance-and-enforcement-commission/post/4","/data/childmaintenance/2011-09-30/Template---Final.xls","person4"
"33","N/D","SCS1","Head of People Development","The People Development Team is responsible for providing a range of products and interventions to support the development of the Commission's people, enabling them to deliver the organisations objectives. The team has specific responsibility for: - Delivery of leadership and management development - identification and development of colleagues with high potential - activity to improve people engagement - design, development, maintenance and evaluation of all business specific training - Ownership of the HR Change programme, ensuring that it is integrated with the overall Commission Change programme.","Department for Work and Pensions","Child Maintenance and Enforcement Commission","Human Resources Directorate","0207 853 8012","transparency.questions@childmaintenance.gsi.gov.uk","6","1364116","1","N/D","N/D","","Human Resources","","","http://reference.data.gov.uk/id/public-body/child-maintenance-and-enforcement-commission/post/33","/data/childmaintenance/2011-09-30/Template---Final.xls","person26"
"2","Susan Park","SCS2","Corporate Affairs Director","The function of the Corporate Affairs directorate is to achieve the objectives provided to the Commission by statute and Ministers by formulating a strategy for the organisation, ensuring that the policy and legal framework is aligned with the strategy, that decision making adheres to the legal framework, and that the reputation of the organisation is managed as we carry the strategy through.","Department for Work and Pensions","Child Maintenance and Enforcement Commission","Corporate Affairs Directorate","0207 853 8012","transparency.questions@childmaintenance.gsi.gov.uk","1","230308","1","120000","124999","","Policy","","","http://reference.data.gov.uk/id/public-body/child-maintenance-and-enforcement-commission/post/2","/data/childmaintenance/2011-09-30/Template---Final.xls","person3"
"36","N/D","SCS1","Clerical and Client Payment Services Director","The Clerical and Client Payment Services Director is responsible for:  Processing receipts and payments as quickly as possible, through the Child Support Agencys collection service.  Improving performance on cases managed off the Commission's main IT systems.  Reducing the number of cases managed off the main IT systems - don't understand this, how can we do this?  Improving the efficiency of managing cases off the main IT systems","Department for Work and Pensions","Child Maintenance and Enforcement Commission","CSA Operations Directorate","0207 853 8012","transparency.questions@childmaintenance.gsi.gov.uk","41","17598485","1","N/D","N/D","","Operational Delivery","","","http://reference.data.gov.uk/id/public-body/child-maintenance-and-enforcement-commission/post/36","/data/childmaintenance/2011-09-30/Template---Final.xls","person28"
"40","N/D","SCS1","Operations Support and Planning Director","The Operations Support and Planning Director is responsible for a range of operational planning activities; primarily focused on planning, supporting performance and service delivery, and co-ordinating effective business improvements.","Department for Work and Pensions","Child Maintenance and Enforcement Commission","CSA Operations Directorate","0207 853 8012","transparency.questions@childmaintenance.gsi.gov.uk","41","9287161","1","N/D","N/D","","Operational Delivery","","","http://reference.data.gov.uk/id/public-body/child-maintenance-and-enforcement-commission/post/40","/data/childmaintenance/2011-09-30/Template---Final.xls","person30"
"43","N/D","SCS1","Legal Enforcement Director","The Legal Enforcement Director is responsible for re-establishing compliance and ensuring maintenance is paid on cases where debt enforcement action has failed. Measures used include charging orders, third party debt orders, obtaining Liability Orders for debt through the Courts, driving licence removal and even the possibility of imprisonment.","Department for Work and Pensions","Child Maintenance and Enforcement Commission","CSA Operations Directorate","0207 853 8012","transparency.questions@childmaintenance.gsi.gov.uk","41","23880451","1","N/D","N/D","","Operational Delivery","","","http://reference.data.gov.uk/id/public-body/child-maintenance-and-enforcement-commission/post/43","/data/childmaintenance/2011-09-30/Template---Final.xls","person33"
"45","N/D","SCS1","Risk & Assurance Director","The Risk and Assurance Director is responsible for: - promoting a risk culture; - identifying, assessing and controlling risks; - ensuring the Commission has an effective control framework in place to minimise risks and for assuring compliance with it, including preparing the annual Statement of Internal Control; - measuring the accuracy and quality of Child Support Agency decisions; - developing and implementing policies and practices to protect the physical security of our people; - providing independent security accreditation services for IT systems; and - embedding effective business continuity arrangements across the organisation.","Department for Work and Pensions","Child Maintenance and Enforcement Commission","Finance and Commercial Directorate","0207 853 8012","transparency.questions@childmaintenance.gsi.gov.uk","7","1727395","1","N/D","N/D","","Operational Delivery","","","http://reference.data.gov.uk/id/public-body/child-maintenance-and-enforcement-commission/post/45","/data/childmaintenance/2011-09-30/Template---Final.xls","person35"
"16","N/D","SCS1","Director of Child Maintenance Options","The Child Maintenance Options service provides free, impartial information on child maintenance arrangements, and supports parents to make informed decisions about the child maintenance arrangement most suited to their circumstances, whether this is a family-based or statutory arrangement or one made through the courts. Child Maintenance Options is available by phone, web or, for those most in need of more personalised help, through a face-to-face service. The Child Maintenance Options team in the Commission manages all aspects of the service from performance to service development.","Department for Work and Pensions","Child Maintenance and Enforcement Commission","Customer Directorate","0207 853 8012","transparency.questions@childmaintenance.gsi.gov.uk","50","248116","0.8","N/D","N/D","","Operational Delivery","","","http://reference.data.gov.uk/id/public-body/child-maintenance-and-enforcement-commission/post/16","/data/childmaintenance/2011-09-30/Template---Final.xls","person14"
"17","N/D","SCS1","Head of Commissioning","The Head of Commissioning manages relationships with commercial partners who provide outsourced services (both client facing and support services). They also manage the procurement and commercial functions, estates and facilities, and relationships with other public sector bodies through service level agreements.","Department for Work and Pensions","Child Maintenance and Enforcement Commission","Finance and Commercial Directorate","0207 853 8012","transparency.questions@childmaintenance.gsi.gov.uk","7","1395913","1","N/D","N/D","","Procurement","","","http://reference.data.gov.uk/id/public-body/child-maintenance-and-enforcement-commission/post/17","/data/childmaintenance/2011-09-30/Template---Final.xls","person15"
"32","N/D","SCS1","Financial Controller & Head of Financial Management","The Financial Accounting, Management and Control team is responsible for all financial reporting. The team: - Produces the annual report and accounts and the client funds account. - Reports financial performance and forecasts to the business monthly. - Accounts for payments of child maintenance to our clients and monitors the Commission's bank accounts. - Manages government spending controls on behalf of the Commission. - Manages financial compliance and propriety. - Designs and implements financial systems and controls. - Monitors costs and recommends savings.","Department for Work and Pensions","Child Maintenance and Enforcement Commission","Finance and Commercial Directorate","0207 853 8012","transparency.questions@childmaintenance.gsi.gov.uk","7","1853066","1","N/D","N/D","","Finance","","","http://reference.data.gov.uk/id/public-body/child-maintenance-and-enforcement-commission/post/32","/data/childmaintenance/2011-09-30/Template---Final.xls","person25"
"44","N/D","SCS1","Debt Enforcement Director","The Debt Enforcement Director is responsible for re-establishing compliance where payments have broken down; ensuring maintenance is paid through debt negotiation and imposing deduction from earning orders where required.","Department for Work and Pensions","Child Maintenance and Enforcement Commission","CSA Operations Directorate","0207 853 8012","transparency.questions@childmaintenance.gsi.gov.uk","41","38048746","1","N/D","N/D","","Operational Delivery","","","http://reference.data.gov.uk/id/public-body/child-maintenance-and-enforcement-commission/post/44","/data/childmaintenance/2011-09-30/Template---Final.xls","person34"
"20","N/D","SCS1","Programme Director","This team are responsible for the delivery of elements of the new child maintenance scheme. This includes the organisation design, site strategy and any third party contracts.","Department for Work and Pensions","Child Maintenance and Enforcement Commission","Change Directorate","0207 853 8012","transparency.questions@childmaintenance.gsi.gov.uk","4","0","1","N/D","N/D","","Programme and Project Management (PPM)","","","http://reference.data.gov.uk/id/public-body/child-maintenance-and-enforcement-commission/post/20","/data/childmaintenance/2011-09-30/Template---Final.xls","person17"
"37","N/D","SCS1","Director of Programme Delivery","The Director of Programme Delivery is responsible for driving delivery of the change programme for the new child maintenance scheme, particularly focusing on risks, issues and interdependencies, whilst ensuring robust plans are in place.","Department for Work and Pensions","Child Maintenance and Enforcement Commission","Change Directorate","0207 853 8012","transparency.questions@childmaintenance.gsi.gov.uk","4","687950","1","N/D","N/D","","Programme and Project Management (PPM)","","","http://reference.data.gov.uk/id/public-body/child-maintenance-and-enforcement-commission/post/37","/data/childmaintenance/2011-09-30/Template---Final.xls","person29"
"9","Vacant","SCS2","Managing Director - CSA","The Managing Director - CSA provides direction to the Agency and is accountable for the management and performance of the Agency.","Department for Work and Pensions","Child Maintenance and Enforcement Commission","CSA","N/A","transparency.questions@childmaintenance.gsi.gov.uk","1","0","1","0","0","","Operational Delivery","","","http://reference.data.gov.uk/id/public-body/child-maintenance-and-enforcement-commission/post/9","/data/childmaintenance/2011-09-30/Template---Final.xls","person8"
"19","N/D","SCS1","Head of Business Architecture and Design","The Business Architecture and Design Team design and develop business processes and procedures.","Department for Work and Pensions","Child Maintenance and Enforcement Commission","Change Directorate","0207 853 8012","transparency.questions@childmaintenance.gsi.gov.uk","4","2289866","1","N/D","N/D","","Programme and Project Management (PPM)","","","http://reference.data.gov.uk/id/public-body/child-maintenance-and-enforcement-commission/post/19","/data/childmaintenance/2011-09-30/Template---Final.xls","person16"
"10","N/D","SCS1","Head of Policy","The Policy division is made up of three teams: Policy Team  Ensuring the law governing child support is fit for purpose and the Commissions policies and procedures, and handling of individual cases are in line with the law and reflect the Government's strategic intent; Advice and Guidance Team - Providing support to frontline colleagues to ensure that child support cases are handled in line with Commission policies and procedures; Judicial Review Team  Ensuring those cases on which we face escalated legal action are managed in line with legal advice and court requirements.","Department for Work and Pensions","Child Maintenance and Enforcement Commission","Corporate Affairs Directorate","0207 853 8012","transparency.questions@childmaintenance.gsi.gov.uk","2","942252","1","N/D","N/D","","Policy","","","http://reference.data.gov.uk/id/public-body/child-maintenance-and-enforcement-commission/post/10","/data/childmaintenance/2011-09-30/Template---Final.xls","person9"
"12","N/D","SCS1","Head of Corporate Communications and External Relationships","The Corporate Communications and External Relationships team is responsible for managing relationships with key external stakeholders, the media and other Government departments, for corporate publications and the corporate website.","Department for Work and Pensions","Child Maintenance and Enforcement Commission","Corporate Affairs Directorate","0207 853 8012","transparency.questions@childmaintenance.gsi.gov.uk","2","636397","1","N/D","N/D","","Communications","","","http://reference.data.gov.uk/id/public-body/child-maintenance-and-enforcement-commission/post/12","/data/childmaintenance/2011-09-30/Template---Final.xls","person11"
"30","N/D","SCS1","Planning Director","The Planning team creates the organisation's corporate plan - securing funding and putting together business cases as required. It is also responsible for detailed analysis, research and management information production to support a range of business decisions. The team is also responsible for the design and operation of all the Commission's internal meetings.","Department for Work and Pensions","Child Maintenance and Enforcement Commission","Finance and Commercial Directorate","0207 853 8012","transparency.questions@childmaintenance.gsi.gov.uk","7","1839921","1","N/D","N/D","","Planning","","","http://reference.data.gov.uk/id/public-body/child-maintenance-and-enforcement-commission/post/30","/data/childmaintenance/2011-09-30/Template---Final.xls","person24"
"1","Noel Shanahan","SCS3","Commissioner","The Commissioner is the Chief Executive of the Commission and provides strategic leadership and direction to the organisation to enable it to achieve its core objective  to maximise the number of effective maintenance arrangements - through promoting financial responsibility, providing information and support through the Child Maintenance Options service and providing an efficient and effective statutory maintenance service, currently through the Child Support Agency. The Commissioner is also responsible for ensuring the organisation meets its objectives for the design and delivery of the future statutory scheme of child maintenance.","Department for Work and Pensions","Child Maintenance and Enforcement Commission","Commissioner","0207 853 8012","transparency.questions@childmaintenance.gsi.gov.uk","XX","200000","1","140000","144999","","Operational Delivery","","","http://reference.data.gov.uk/id/public-body/child-maintenance-and-enforcement-commission/post/1","/data/childmaintenance/2011-09-30/Template---Final.xls","person2"
"41","N/D","SCS1","CSA Operations Director","The CSA Operations Director is responsible for providing direction to the operation of the current statutory schemes and for the delivery of performance indicators and service standards. This means delivering improved client service whilst continuing to achieve efficiencies. Chris does more than this now - does future scheme ops as well, shouldn't this be reflected?","Department for Work and Pensions","Child Maintenance and Enforcement Commission","CSA Operations Directorate","0207 853 8012","transparency.questions@childmaintenance.gsi.gov.uk","1","0","1","N/D","N/D","","Operational Delivery","","","http://reference.data.gov.uk/id/public-body/child-maintenance-and-enforcement-commission/post/41","/data/childmaintenance/2011-09-30/Template---Final.xls","person31"
"23","N/D","SCS1","Head of Information Systems","The Information Systems team is responsible for the architecture, delivery and testing of the Commission's information systems. Architecture roles include: - developing the information system strategy, - setting architecture standards and principles, - proposing cost effective solutions to meet business needs. Delivery includes: - defining delivery standards and methods, - the management of third party suppliers delivering new solutions or enhancements, and - using product configuration capabilities where appropriate. Testing includes: - definition of testing standards, - test assurance of third party suppliers and - the planning and execution of user acceptance testing.","Department for Work and Pensions","Child Maintenance and Enforcement Commission","Information and Technology Directorate","0207 853 8012","transparency.questions@childmaintenance.gsi.gov.uk","5","2674670","1","N/D","N/D","","Information Technology","","","http://reference.data.gov.uk/id/public-body/child-maintenance-and-enforcement-commission/post/23","/data/childmaintenance/2011-09-30/Template---Final.xls","person19"
"24","N/D","SCS1","Head of Service Management","The Service Management team is responsible for technical architecture, service management and IT security. Technical architecture includes developing and delivering the technology strategies for the Commission's IT infrastructure (including servers, desktop and telephony). Service management includes: - defining the strategy for the operational management of the Commission's systems and infrastructure, - managing the third party operational suppliers, and - managing the IT budget. IT security includes: - managing and governing IT security, - developing technical security architectures and solutions, - conducting security accreditations and - managing operational IT security incidents.","Department for Work and Pensions","Child Maintenance and Enforcement Commission","Information and Technology Directorate","0207 853 8012","transparency.questions@childmaintenance.gsi.gov.uk","5","0","1","N/D","N/D","","Information Technology","","","http://reference.data.gov.uk/id/public-body/child-maintenance-and-enforcement-commission/post/24","/data/childmaintenance/2011-09-30/Template---Final.xls","person20"
"26","N/D","SCS1","Head of Organisational Capability","The Organisational Capability Team is responsible for the way the organisation is structured and for ensuring that the right number of people are available in the right locations and with the right skills to deliver the Commission's objectives. The Organisational Capability team also ensures and develops skills for senior leaders as well as leading succession planning for pivotal roles.","Department for Work and Pensions","Child Maintenance and Enforcement Commission","Human Resources Directorate","0207 853 8012","transparency.questions@childmaintenance.gsi.gov.uk","6","254664","1","N/D","N/D","","Human Resources","","","http://reference.data.gov.uk/id/public-body/child-maintenance-and-enforcement-commission/post/26","/data/childmaintenance/2011-09-30/Template---Final.xls","person22"
"7","Alan Hardy","SCS2","Finance and Commercial Director","The Finance and Commercial Directorate is responsible for all financial matters and for ensuring that value for money is delivered. This includes: - financial management, - reporting, - accounting, - business performance reporting, and - client funds accounting. Colleagues within the directorate contribute to the future direction of the organisation by offering advice to the Executive Team, Board and Ministers - and by delivering strategic planning, analysis and research activities. The directorate is also responsible for commercial and supplier relationships, estate management and governance, and risk and assurance activity.","Department for Work and Pensions","Child Maintenance and Enforcement Commission","Finance and Commercial Directorate","0207 853 8012","transparency.questions@childmaintenance.gsi.gov.uk","1","0","1","135000","139999","","Finance","","","http://reference.data.gov.uk/id/public-body/child-maintenance-and-enforcement-commission/post/7","/data/childmaintenance/2011-09-30/Template---Final.xls","person7"
"21","Vacant","SCS1","Programme Director","The team are responsible for the planning, designing, building and delivery of the new child maintenance scheme. This incorporates working with key third parties in order to deliver a system that meets the needs of clients and the Commission's people.","Department for Work and Pensions","Child Maintenance and Enforcement Commission","Change Directorate","N/A","transparency.questions@childmaintenance.gsi.gov.uk","4","0","1","N/D","N/D","","Programme and Project Management (PPM)","","","http://reference.data.gov.uk/id/public-body/child-maintenance-and-enforcement-commission/post/21","/data/childmaintenance/2011-09-30/Template---Final.xls","person18"
"34","N/D","SCS1","Head of IT Services","The IT Services team provides operational service management for the Commission's current applications and infrastructure. The team is responsible for incident, problem, availability, change request and service level management. Working with our IT suppliers, it ensures that our systems meet business needs in a cost effective manner. The team also provides IT services to support desktop PCs, telephones and networks. It also provides security accreditation and assurance services.","Department for Work and Pensions","Child Maintenance and Enforcement Commission","Information and Technology Directorate","0207 853 8012","transparency.questions@childmaintenance.gsi.gov.uk","5","3213946","1","N/D","N/D","","Information Technology","","","http://reference.data.gov.uk/id/public-body/child-maintenance-and-enforcement-commission/post/34","/data/childmaintenance/2011-09-30/Template---Final.xls","person27"
"6","Ian Pavey","SCS2","Human Resources Director","The HR Directorate is responsible for providing effective HR leadership and direction. It shapes and embeds the Commission's 'People Strategy', ensuring that it supports delivery of the organisation's objectives to the highest standards. The Directorate has specific responsibility for: - organisational design - organisational capability including leadership development - recruitment - workforce planning, - HR policy, pay and reward - internal communications - Health and Safety - provision of operational HR support and services - training design, and - employee relations.","Department for Work and Pensions","Child Maintenance and Enforcement Commission","Human Resources Directorate","0207 853 8012","transparency.questions@childmaintenance.gsi.gov.uk","1","319151","1","115000","119999","","Human Resources","","","http://reference.data.gov.uk/id/public-body/child-maintenance-and-enforcement-commission/post/6","/data/childmaintenance/2011-09-30/Template---Final.xls","person6"
"42","N/D","SCS1","Client Services Director","The Client Services Director is responsible for: - Assessing and making payment arrangements for new and repeat child maintenance applications. - Updating child maintenance cases by processing changes of circumstances to ensure that the correct amount of child maintenance is paid. - The provision of telephony, face to face visiting and Welsh language services. - Responding to complaints received from clients or MPs, ensuring that the reason for the complaint is addressed and appropriate action taken to resolve the issues.","Department for Work and Pensions","Child Maintenance and Enforcement Commission","CSA Operations Directorate","0207 853 8012","transparency.questions@childmaintenance.gsi.gov.uk","41","45563825","1","N/D","N/D","","Operational Delivery","","","http://reference.data.gov.uk/id/public-body/child-maintenance-and-enforcement-commission/post/42","/data/childmaintenance/2011-09-30/Template---Final.xls","person32"
