"11","N/D","SCS1","Head of Strategy","The purpose of the Strategy team is to develop a coherent high-level strategy for the Commission, setting out how its three key functions will be developed to realise the Commissions vision and meet its statutory objectives. The work of the team covers: - strategic advice to the Commission Board; - development of policy on the new statutory scheme using income data from HM Revenue and Customs; - developing strategy for promoting financial responsibility and the longer term development of the information and support function including - cross-government opportunities; - strategic input to the corporate planning process.","Department for Work and Pensions","Child Maintenance and Enforcement Commission","Corporate Affairs Directorate","0207 853 8012","transparency.questions@childmaintenance.gsi.gov.uk","2","291661","1","N/D","N/D","","Policy","","","http://reference.data.gov.uk/id/public-body/child-maintenance-and-enforcement-commission/post/11","/data/childmaintenance/2011-09-30/Template---Final.xls","person10"
"13","N/D","SCS1","Head of Legal","The Legal Team provides a wide ranging legal advice service to the Commission, covering commercial contracts/procurement exercises (including business process outsourcing and specialist services), employment law/transfers of undertakings, privacy law, freedom of information, civil enforcement and public law. The Head of Legal is the Legal Advisor to the Commission and is responsible for Board Governance. The Team also incorporates a criminal prosecutions function which brings prosecutions for fraud, theft and other offences under Child Support Legislation.","Department for Work and Pensions","Child Maintenance and Enforcement Commission","Corporate Affairs Directorate","0207 853 8012","transparency.questions@childmaintenance.gsi.gov.uk","2","239680","1","N/D","N/D","","Law","","","http://reference.data.gov.uk/id/public-body/child-maintenance-and-enforcement-commission/post/13","/data/childmaintenance/2011-09-30/Template---Final.xls","person12"
"25","N/D","SCS1","Head of Information Management","The Information Management team is responsible for information assurance, knowledge management and management information systems for the Commission. Information assurance includes defining the approach to the protection of information (including that of clients) and providing assurance of information risks. Knowledge management includes the approach to managing unstructured data and developing and delivering solutions to support this approach. Management information includes the development and delivery of a 'data warehouse', business intelligence and other management information systems and the maintenance of the Commission's data model.","Department for Work and Pensions","Child Maintenance and Enforcement Commission","Information and Technology Directorate","0207 853 8012","transparency.questions@childmaintenance.gsi.gov.uk","5","926855","1","N/D","N/D","","Knowledge and Information Management (KIM)","","","http://reference.data.gov.uk/id/public-body/child-maintenance-and-enforcement-commission/post/25","/data/childmaintenance/2011-09-30/Template---Final.xls","person21"
"28","N/D","SCS1","Head of Strategy, Policy and Reward","The Strategy, Policy and Reward team has two main functions: - to provide HR strategy, reward and policy development (including reward, employee relations, employment matters and Senior Civil Service matters); and - to design and build new ways of working to support the delivery of the new child maintenance scheme.","Department for Work and Pensions","Child Maintenance and Enforcement Commission","Human Resources Directorate","0207 853 8012","transparency.questions@childmaintenance.gsi.gov.uk","6","416000","1","N/D","N/D","","Human Resources","","","http://reference.data.gov.uk/id/public-body/child-maintenance-and-enforcement-commission/post/28","/data/childmaintenance/2011-09-30/Template---Final.xls","person23"
"50","N/D","SCS1","Customer Director","The Customer Directorate is responsible for ensuring that the needs of the client are understood by the Commission and translated into the services and client communications which are delivered. These responsibilities cover service design and development for the statutory schemes; marketing and communications, the Child Maintenance Options service and operational responsibility for Complaints and Appeals on the statutory schemes. Responsibilities include:  Developing and delivering the Child Maintenance Options service, through which the Commission discharges its function to provide information and support to help parents make their own decisions about child maintenance  Service design and improvement of the statutory schemes  Marketing and communications across all media  Operational management of complaints and appeals in the statutory schemes, using customer feedback to drive improvements.","Department for Work and Pensions","Child Maintenance and Enforcement Commission","Customer Directorate","0207 853 8012","transparency.questions@childmaintenance.gsi.gov.uk","1","5829050","1","N/D","N/D","","Operational Delivery","","","http://reference.data.gov.uk/id/public-body/child-maintenance-and-enforcement-commission/post/50","/data/childmaintenance/2011-09-30/Template---Final.xls","person40"
"48","N/D","SCS1","Head of HR Operations","The Head of HR Operations provides clear direction and support in the development and delivery of HR products. This involves work in the following areas: Business Partners  Provision of expert HR decision making, support and guidance  Embedding HR policies and providing appropriate skills and awareness  Employee Relations and Health & Safety  Management of operational consultation forums  Development and implementation of the Employee Relations Framework Workforce planning  Implementation of workforce plans  Maintaining and controlling change to operational organisational design  Development and management of attendance management strategy","Department for Work and Pensions","Child Maintenance and Enforcement Commission","Human Resources Directorate","0207 853 8012","transparency.questions@childmaintenance.gsi.gov.uk","6","2555602","1","N/D","N/D","","Human Resources","","","http://reference.data.gov.uk/id/public-body/child-maintenance-and-enforcement-commission/post/48","/data/childmaintenance/2011-09-30/Template---Final.xls","person38"
"49","N/D","SCS1","Head of Product & Service Development - Statutory Scheme","The Head of Product & Service Development brings together client insight and government policy to define and develop the services that will be offered by the Commission. They also define the client experience and specify the service that will be delivered by Operational colleagues","Department for Work and Pensions","Child Maintenance and Enforcement Commission","Customer Directorate","0207 853 8012","transparency.questions@childmaintenance.gsi.gov.uk","50","523030","1","N/D","N/D","","Operational Delivery","","","http://reference.data.gov.uk/id/public-body/child-maintenance-and-enforcement-commission/post/49","/data/childmaintenance/2011-09-30/Template---Final.xls","person39"
