"FPO002","Lyn Simpson","SCS2","Director NHS Operations","'Clinical performance in conjunction with CNO and NHS Medical Director. Interface and negotiation with the NHS on emerging priority areas which require a co-ordinated response. NHS Business Unit and interface with SHAs Health service provision for 2012 Olympics SHA assurance framework.'","Department of Health","Department of Health","NHS Finance Performance & Operations Directorate","020 7210 4850","N/D","FPO001","303618","1","0","0","","Operational Delivery","","","http://reference.data.gov.uk/id/department/dh/post/FPO002","/data/dh/2011-09-30/Government-staff-and-salary-data---Working---05.12.11.xls","person150"
"NHSCEO05","N/D","SCS1","Policy Advisor","Responsible for: advice to NHS Chief Executive on policy, strategy and communications","Department of Health","Department of Health","Office of the NHS Leadership Team","020 7210 4850","N/D","NHSCEO02","N/D","1","N/D","N/D","","Policy","","","http://reference.data.gov.uk/id/department/dh/post/NHSCEO05","/data/dh/2011-09-30/Government-staff-and-salary-data---Working---05.12.11.xls","person213"
"RDD007","N/D","SCS1","Deputy Director - Head of NHS Research Infrastructure & Industry and R&D Relations","'Responsible for -NIHR Infrastructure for Research - Clinical Research Networks Biomedical Research Centres and Units - Clinical Research Facilities - Collaborations for Leadership in Applied Health Research and Care - R&D Relations with Pharma, Biotech, and Medtech.'","Department of Health","Department of Health","Research & Development Directorate","020 7210 4850","N/D","RDD002","N/D","1","N/D","N/D","","Policy","","","http://reference.data.gov.uk/id/department/dh/post/RDD007","/data/dh/2011-09-30/Government-staff-and-salary-data---Working---05.12.11.xls","person293"
"MD039","N/D","SCS1","National Clinical Director for Venous Thromboembolism","'National clinical directors and advisors, are experts that each oversee the implementation of a national service framework (NSF) or major clinical or service strategy. They act as advocates for the NSFs or strategy within the NHS and other services, and represent the NHS and other services in the Department of Health.'","Department of Health","Department of Health","NHS Medical Directorate","020 7210 4850","N/D","MD001","0","0.2","N/D","N/D","","Policy","","","http://reference.data.gov.uk/id/department/dh/post/MD039","/data/dh/2011-09-30/Government-staff-and-salary-data---Working---05.12.11.xls","person207"
"CDD020","N/D","SCS1","Deputy Director - HR Change Team","'Responsible for: HR Framework Displacement Selection Transition Pool Exits (Change and Business as Usual) Staff Support Outplacement Restructuring Redeployment SCS Unit'","Department of Health","Department of Health","Corporate Development Directorate","020 7210 4850","N/D","CDD001","373553","1","N/D","N/D","","Human Resources","","","http://reference.data.gov.uk/id/department/dh/post/CDD020","/data/dh/2011-09-30/Government-staff-and-salary-data---Working---05.12.11.xls","person43"
"PR005","N/D","SCS1","Deputy Director - Head of Social Enterprise and System Levers","Responsible for the Social Enterprise Unit, Choice Policy, Any Willing Provider Programme and PROMs.'","Department of Health","Department of Health","Managing Director for Provider Development","020 7210 4850","N/D","PR002","1328498","1","N/D","N/D","","Policy","","","http://reference.data.gov.uk/id/department/dh/post/PR005","/data/dh/2011-09-30/Government-staff-and-salary-data---Working---05.12.11.xls","person123"
"MD014","N/D","SCS1","Deputy Director - Senior Economic Advisor","'Responsible for: -Economic analysis and advice -Modelling -Statistical advice *also covers some work in CPS.'","Department of Health","Department of Health","NHS Medical Directorate","020 7210 4850","N/D","MD012","783837","1","N/D","N/D","","Economics","","","http://reference.data.gov.uk/id/department/dh/post/MD014","/data/dh/2011-09-30/Government-staff-and-salary-data---Working---05.12.11.xls","person189"
"MD033","N/D","SCS1","Deputy Director - Screening & Specialised Services","'Responsible for Screening & Specialised Services Policy.'","Department of Health","Department of Health","NHS Medical Directorate","020 7210 4850","N/D","MD030","N/D","0.92","N/D","N/D","","Policy","","","http://reference.data.gov.uk/id/department/dh/post/MD033","/data/dh/2011-09-30/Government-staff-and-salary-data---Working---05.12.11.xls","person201"
"MD036","N/D","SCS1","Deputy Director - Clinical Strategies & Audit Policy","'Responsible for Clinical strategies (COPD, trauma, liver, VTE, organ donation & pathology) & Clinical Audit policy.'","Department of Health","Department of Health","NHS Medical Directorate","020 7210 4850","N/D","MD030","1049664","1","N/D","N/D","","Policy","","","http://reference.data.gov.uk/id/department/dh/post/MD036","/data/dh/2011-09-30/Government-staff-and-salary-data---Working---05.12.11.xls","person204"
"MD025","N/D","SCS1","Academic & Training Programme Director","'Responsible for: MSC Education & Training framework and programmes; academic career pathway development; HEI strategic development.'","Department of Health","Department of Health","NHS Medical Directorate","020 7210 4850","N/D","MD023","0","0.8","N/D","N/D","","Policy","","","http://reference.data.gov.uk/id/department/dh/post/MD025","/data/dh/2011-09-30/Government-staff-and-salary-data---Working---05.12.11.xls","person193"
"RDD012","N/D","SCS1","Deputy Director - Head of Research Information and Intelligence","Responsible for - Maximising the opportunities for better use of information to increase the efficiency and impact of health research in England; development delivery and use of effective and efficient systems to manage research information mobilise research outputs and evaluate the impact of DH investment in research.","Department of Health","Department of Health","Research & Development Directorate","020 7210 4850","N/D","RDD002","N/D","1","N/D","N/D","","Policy","","","http://reference.data.gov.uk/id/department/dh/post/RDD012","/data/dh/2011-09-30/Government-staff-and-salary-data---Working---05.12.11.xls","person298"
"HIP008","N/D","SCS1","Public Health Intelligence - Leadership and Workforce","'Responsible for: Public Health Intelligence, Leadership & Workforce Development.'","Department of Health","Department of Health","Health Improvement & Protection Directorate","020 7210 4850","N/D","HIP005","0","1","N/D","N/D","","Policy","","","http://reference.data.gov.uk/id/department/dh/post/HIP008","/data/dh/2011-09-30/Government-staff-and-salary-data---Working---05.12.11.xls","person57"
"PR013","N/D","SCS1","Financial Assessment Executive","Responsible for financial reviews of Foundation Trust applicants","Department of Health","Department of Health","Managing Director for Provider Development","020 7210 4850","N/D","PR009","0","0.5","N/D","N/D","","Operational Delivery","","","http://reference.data.gov.uk/id/department/dh/post/PR013","/data/dh/2011-09-30/Government-staff-and-salary-data---Working---05.12.11.xls","person131"
"MD022","Keith Ridge","SCS2","Chief Pharmaceutical Officer","'Provides national leadership to the pharmacy profession. Responsible for policy relating to the profession including modernising pharmacy careers and professional regulation of pharmacists.'","Department of Health","Department of Health","Policy Strategy & Finance Directorate","020 7210 4850","N/D","MD016","305175","1","90000","94999","","Policy","","","http://reference.data.gov.uk/id/department/dh/post/MD022","/data/dh/2011-09-30/Government-staff-and-salary-data---Working---05.12.11.xls","person220"
"SCLGCP001","David Behan","SCS3","Director General for Social Care - Local Government & Care Partnerships","'Providing leadership and strategic direction for adult social care, mental health, disability, offender health and in developing DH's relationships with local and regional government.'","Department of Health","Department of Health","Social Care Local Government & Care Partnerships Directorate","020 7210 4850","N/D","PSO001","79494","1","180000","184999","","Policy","","","http://reference.data.gov.uk/id/department/dh/post/SCLGCP001","/data/dh/2011-09-30/Government-staff-and-salary-data---Working---05.12.11.xls","person300"
"SCLGCP014","N/D","SCS1","Deputy Regional Director for Social Care and Local Partnerships - South East","'Responsible for: Leadership for the delivery of Social Care in the region.'","Department of Health","Department of Health","Social Care Local Government & Care Partnerships Directorate","020 7210 4850","N/D","SCLGCP008","0","1","N/D","N/D","","Policy","","","http://reference.data.gov.uk/id/department/dh/post/SCLGCP014","/data/dh/2011-09-30/Government-staff-and-salary-data---Working---05.12.11.xls","person313"
"SCLGCP032","N/D","SCS1","Deputy Director - Care Provider Continuity","Head of Care Provider Continuity","Department of Health","Department of Health","Social Care Local Government & Care Partnerships Directorate","020 7210 4850","N/D","SCLGCP002","0","1","N/D","N/D","","Policy","","","http://reference.data.gov.uk/id/department/dh/post/SCLGCP032","/data/dh/2011-09-30/Government-staff-and-salary-data---Working---05.12.11.xls","person329"
"HIP030","N/D","SCS1","Deputy Director - Tobacco and Health Improvement Policy","'Responsible for: Tobacco and Health Improvement Policy.'","Department of Health","Department of Health","Health Improvement & Protection Directorate","020 7210 4850","N/D","HIP026","N/D","1","N/D","N/D","","Policy","","","http://reference.data.gov.uk/id/department/dh/post/HIP030","/data/dh/2011-09-30/Government-staff-and-salary-data---Working---05.12.11.xls","person79"
"IMP006","N/D","SCS1","Deputy Director - Head of Long Term Conditions","'Responsible for Long Term Conditions generic model, Self Care, Case Management and Care Planning, telehealth and telecare, Whole System Demonstrator Programme.'","Department of Health","Department of Health","National Director for Improvement & Efficiency","020 7210 4850","N/D","IMP002","373525","1","N/D","N/D","","Policy","","","http://reference.data.gov.uk/id/department/dh/post/IMP006","/data/dh/2011-09-30/Government-staff-and-salary-data---Working---05.12.11.xls","person144"
"CD023","N/D","SCS1","PMC Lead","Resonsible for: NHS CB PMC Function","Department of Health","Department of Health","Managing Director for Commissioning Development","020 7210 4850","N/D","CD017","0","1","N/D","N/D","","Policy","","","http://reference.data.gov.uk/id/department/dh/post/CD023","/data/dh/2011-09-30/Government-staff-and-salary-data---Working---05.12.11.xls","person109"
"FPO030","N/D","SCS1","Deputy Director Mid Staffordshire Publice Inquiry","'Leading public inquiry for Mid Staffordshire Hospital Foundation Trust.'","Department of Health","Department of Health","NHS Finance Performance & Operations Directorate","020 7210 4850","N/D","FPO017","N/D","1","N/D","N/D","","Policy","","","http://reference.data.gov.uk/id/department/dh/post/FPO030","/data/dh/2011-09-30/Government-staff-and-salary-data---Working---05.12.11.xls","person175"
"PSF032","N/D","SCS1","Planning Integration Manager","'Managing the overall Transition Programme planning framework. Coordinate and overseeing risks and issues across the programme. Overseeing production of reports and plans for the programme boards.'","Department of Health","Department of Health","Policy Strategy & Finance Directorate","020 7210 4850","N/D","PSF008","N/D","1","N/D","N/D","","Programme and Project Management (PPM)","","","http://reference.data.gov.uk/id/department/dh/post/PSF032","/data/dh/2011-09-30/Government-staff-and-salary-data---Working---05.12.11.xls","person248"
"RPH027","N/D","SCS1","Consultant in Public Health - East Midlands","'Responsible for Health Programmes and Health Development.'","Department of Health","Department of Health","Regional Public Health Group East Midlands","020 7210 4850","N/D","RPH028","0","1","N/D","N/D","","Policy","","","http://reference.data.gov.uk/id/department/dh/post/RPH027","/data/dh/2011-09-30/Government-staff-and-salary-data---Working---05.12.11.xls","person260"
"RDD011","N/D","SCS1","Deputy Director - Policy Research Programme","Responsible for - Strategic Lead on key areas of the Policy Research Programme'","Department of Health","Department of Health","Research & Development Directorate","020 7210 4850","N/D","RDD009","N/D","1","N/D","N/D","","Policy","","","http://reference.data.gov.uk/id/department/dh/post/RDD011","/data/dh/2011-09-30/Government-staff-and-salary-data---Working---05.12.11.xls","person297"
"SCLGCP008","Glen Mason","SCS2","Director of Social Care Leadership and Performance","'Responsible for improving the quality, performance and status of social care through strengthening the focus on outcomes, increasing the capacity and capability of the workforce, enhancing leadership and providing a local government perspective in the Department.'","Department of Health","Department of Health","Social Care Local Government & Care Partnerships Directorate","020 7210 4850","N/D","SCLGCP001","220110","1","120000","124999","","Policy","","","http://reference.data.gov.uk/id/department/dh/post/SCLGCP008","/data/dh/2011-09-30/Government-staff-and-salary-data---Working---05.12.11.xls","person307"
"SCLGCP020","N/D","SCS1","Deputy Director - Mental Health Experience Access & Hub","'Responsible for: policy management and development around inequalities, public mental health, employment social inclusion, access to psychological therapies, stigma, choice & personalisation, asylum seeker & refugee health; Parliamentary business, communications, business planning, financial management, independent sector funding.'","Department of Health","Department of Health","Social Care Local Government & Care Partnerships Directorate","020 7210 4850","N/D","SCLGCP019","396991","1","N/D","N/D","","Policy","","","http://reference.data.gov.uk/id/department/dh/post/SCLGCP020","/data/dh/2011-09-30/Government-staff-and-salary-data---Working---05.12.11.xls","person319"
"SCLGCP022","N/D","SCS1","Deputy Director - Independent Living Programme","'Responsible for: Policy on services for disabled adults, including: provision of community equipment, assistive technology cross-government working on independent living/equality Valuing People Now Programme Autism Strategy Programme user-led organisations Briefing and support to ministers on the above.'","Department of Health","Department of Health","Social Care Local Government & Care Partnerships Directorate","020 7210 4850","N/D","SCLGCP019","N/D","0.8","N/D","N/D","","Policy","","","http://reference.data.gov.uk/id/department/dh/post/SCLGCP022","/data/dh/2011-09-30/Government-staff-and-salary-data---Working---05.12.11.xls","person321"
"CDD013","N/D","SCS1","Deputy Director of Information Services Strategy & Delivery","'Responsible for - Business & systems analysis; Project commissioning, management & Support; Technical architecture, Design standards & principles; Customer relationship ownership & accountability; Major projects & corporate system rollout & ongoing benefits realisation; Management of flexible pool relationships & Contracts; IS Finance Support & Asset Accounting; IMS3 Programme'","Department of Health","Department of Health","Corporate Development Directorate","020 7210 4850","N/D","CDD012","1520267","1","N/D","N/D","","Information Technology","","","http://reference.data.gov.uk/id/department/dh/post/CDD013","/data/dh/2011-09-30/Government-staff-and-salary-data---Working---05.12.11.xls","person36"
"CDD024","Carole Clark","SCS2","Business Support Services Transformation Programme - Head of Eastates Transformation","Responsible for - Shared Services for Estates","Department of Health","Department of Health","Corporate Development Directorate","020 7210 4850","N/D","CDD021","0","1","0","0","","Operational Delivery","","","http://reference.data.gov.uk/id/department/dh/post/CDD024","/data/dh/2011-09-30/Government-staff-and-salary-data---Working---05.12.11.xls","person47"
"RPH016","N/D","SCS1","Deputy Director - Consultant in Public Health - Public Health for South West","'Oversees implementation of programmes to reduce health inequalities and improve the health and wellbeing of the population across the South West with specific responsibility for children and young people.'","Department of Health","Department of Health","Regional Public Health Group South West","020 7210 4850","N/D","RPH015","N/D","1","N/D","N/D","","Policy","","","http://reference.data.gov.uk/id/department/dh/post/RPH016","/data/dh/2011-09-30/Government-staff-and-salary-data---Working---05.12.11.xls","person277"
"SCLGCP002","Shaun Gallagher","SCS2","Director of Social Care Policy","'Leadership of the Social Care Policy Division, encompassing strategy and policy for adult social care, including funding reform and legislation; the transformation programme for social care to enable greater choice, control and personalisation of services (including direct payments and personal budgets); strategies on older peoples services, dementia, carers, dignity in care, and safeguarding. It is also responsible for policy on social care finance and efficiency, and provides DH's lead on Social Care for the Comprehensive Spending Review.'","Department of Health","Department of Health","Social Care Local Government & Care Partnerships Directorate","020 7210 4850","N/D","SCLGCP001","139713","1","90000","94999","","Policy","","","http://reference.data.gov.uk/id/department/dh/post/SCLGCP002","/data/dh/2011-09-30/Government-staff-and-salary-data---Working---05.12.11.xls","person301"
"SCLGCP015","N/D","SCS1","Deputy Regional Director for Social Care and Local Partnerships - London","'Responsible for: Leadership for the delivery of Social Care in the region.'","Department of Health","Department of Health","Social Care Local Government & Care Partnerships Directorate","020 7210 4850","N/D","SCLGCP008","0","1","N/D","N/D","","Policy","","","http://reference.data.gov.uk/id/department/dh/post/SCLGCP015","/data/dh/2011-09-30/Government-staff-and-salary-data---Working---05.12.11.xls","person314"
"RPH021","N/D","SCS1","Deputy Regional Director - Yorkshire and Humber","'Responsible for Regional Public Health Group.'","Department of Health","Department of Health","Regional Public Health Group Yorkshire and the Humber","020 7210 4850","N/D","RPH020","0","1","N/D","N/D","","Policy","","","http://reference.data.gov.uk/id/department/dh/post/RPH021","/data/dh/2011-09-30/Government-staff-and-salary-data---Working---05.12.11.xls","person286"
"HIP023","N/D","SCS1","Deputy Director - Pandemic Influenza","'Responsible for: Operational Readiness - NHS & Social Care'","Department of Health","Department of Health","Health Improvement & Protection Directorate","020 7210 4850","N/D","HIP022","N/D","1","N/D","N/D","","Policy","","","http://reference.data.gov.uk/id/department/dh/post/HIP023","/data/dh/2011-09-30/Government-staff-and-salary-data---Working---05.12.11.xls","person72"
"CD008","N/D","SCS1","Deputy Director - NHS Commissioning Board Implementation Team","'Responsible for: Establishing the NHS Commissioning Board as an NDPB by July 2012 and as a Special Health Authority in October 2011.'","Department of Health","Department of Health","Managing Director for Commissioning Development","020 7210 4850","N/D","CD014","1067632","0.8","N/D","N/D","","Policy","","","http://reference.data.gov.uk/id/department/dh/post/CD008","/data/dh/2011-09-30/Government-staff-and-salary-data---Working---05.12.11.xls","person94"
"FPO022","N/D","SCS1","Deputy Director NHS Operations","'Responsible for: NHS Operations NHS Foundation Trusts (see Bob Alexander) NHS Business Unit.'","Department of Health","Department of Health","NHS Finance Performance & Operations Directorate","020 7210 4850","N/D","FPO017","1235777","1","N/D","N/D","","Policy","","","http://reference.data.gov.uk/id/department/dh/post/FPO022","/data/dh/2011-09-30/Government-staff-and-salary-data---Working---05.12.11.xls","person167"
"PSF027","N/D","SCS1","Deputy Director Head of Regulatory Reform Branch","'Promoting better regulation & BRE sponsorship support better regulation minister lead on regulatory reform levers: One in one out sunsetting micro-exemption statement of new regulation & regulatory Impact Assessment Consultation coordination Reducing NHS data burdens programme review of statutory regulation minimising burden.'","Department of Health","Department of Health","Policy Strategy & Finance Directorate","020 7210 4850","N/D","PSF026","N/D","1","N/D","N/D","","Policy","","","http://reference.data.gov.uk/id/department/dh/post/PSF027","/data/dh/2011-09-30/Government-staff-and-salary-data---Working---05.12.11.xls","person244"
"MD001","Prof Sir Bruce Keogh","SCS3","Medical Director","'The role of the Medical Director is central to the engagement of the health service, and a broad range of health care professionals, in improving the care of patients. This is delivered through both specific strategies such as those for cancer, vascular disease and lung disease, and through broader policies to improve patient safety, prescribing, medicines management, service quality and clinical cost-effectiveness, along with post-graduate education of doctors, dentists, pharmacists, and clinical scientists. He also oversees the work programme for the National Institute of Clinical Excellence (NICE) and the National Patient Safety Agency (NPSA).'","Department of Health","Department of Health","NHS Medical Directorate","020 7210 4850","N/D","NHSCEO01","657505","1","190000","194999","","Policy","","","http://reference.data.gov.uk/id/department/dh/post/MD001","/data/dh/2011-09-30/Government-staff-and-salary-data---Working---05.12.11.xls","person177"
"RPH009","N/D","SCS1","Consultant in Public Health - Public Health for West Midlands","'Responsible for Regional Public Health Group.'","Department of Health","Department of Health","Regional Public Health Group West Midlands","020 7210 4850","N/D","RPH006","N/D","1","N/D","N/D","","Policy","","","http://reference.data.gov.uk/id/department/dh/post/RPH009","/data/dh/2011-09-30/Government-staff-and-salary-data---Working---05.12.11.xls","person284"
"WFD009","Gavin Larner","SCS2","Director - Professional Standards","'Advice, policy development and implementation of a range of issues relating to the regulation of health and social care staff.'","Department of Health","Department of Health","Workforce Directorate","020 7210 4850","N/D","WFD001","25856","1","85000","89999","","Policy","","","http://reference.data.gov.uk/id/department/dh/post/WFD009","/data/dh/2011-09-30/Government-staff-and-salary-data---Working---05.12.11.xls","person336"
"PSO001","Una O'Brien","SCS3","Permanent Secretary of the Department of Health","'Leadership and management of the Department of Health. Ensuring the department operates efficiently and coherently as a department of state in support of Ministers, including effective cross-Government working.'","Department of Health","Department of Health","DH Permanent Secretary - Private Office","020 7210 4850","N/D","REFPOST","0","1","160000","164999","","Operational Delivery","","","http://reference.data.gov.uk/id/department/dh/post/PSO001","/data/dh/2011-09-30/Government-staff-and-salary-data---Working---05.12.11.xls","person48"
"FPO004","N/D","SCS1","Deputy Director Programme Management - Planning & Controls","'Responsible for: Programme Planning Programme Controls Reporting risks and issues QA Business planning.'","Department of Health","Department of Health","NHS Finance Performance & Operations Directorate","020 7210 4850","N/D","FPO003","N/D","1","N/D","N/D","","Programme and Project Management (PPM)","","","http://reference.data.gov.uk/id/department/dh/post/FPO004","/data/dh/2011-09-30/Government-staff-and-salary-data---Working---05.12.11.xls","person152"
"FPO010","Bob Alexander","SCS2","Director of NHS Finance","'Responsible for NHS financial strategy and performance including monitoring, improvement and turnaround, financial capability). Development and management of NHS tariffs (payment by results). NHS Capital Programme.'","Department of Health","Department of Health","NHS Finance Performance & Operations Directorate","020 7210 4850","N/D","FPO001","610838","1","145000","149999","","Finance","","","http://reference.data.gov.uk/id/department/dh/post/FPO010","/data/dh/2011-09-30/Government-staff-and-salary-data---Working---05.12.11.xls","person157"
"PSF019","N/D","SCS1","Deputy Director Policy Unit","'Responsible for Primary legislation including the Health and Social Care Bill Secondary legislation following on from the Health and Social Care Bill Improving policy-making across DH.'","Department of Health","Department of Health","Policy Strategy & Finance Directorate","020 7210 4850","N/D","PSF017","902240","0.7","N/D","N/D","","Policy","","","http://reference.data.gov.uk/id/department/dh/post/PSF019","/data/dh/2011-09-30/Government-staff-and-salary-data---Working---05.12.11.xls","person236"
"WFD018","Richard Jeavons","SCS2","Director - Leadership","'Support the NHS and Social Care to define and implement a leadership model at an individual, organisational and system level; increase the talent pool of potential NHS leaders; and embed the NHS leadership model into all leadership development activity.'","Department of Health","Department of Health","Workforce Directorate","020 7210 4850","N/D","WFD001","659773","0.4","190000","194999","","Policy","","","http://reference.data.gov.uk/id/department/dh/post/WFD018","/data/dh/2011-09-30/Government-staff-and-salary-data---Working---05.12.11.xls","person342"
