"33","N/D","SCS1","Head of Renewables Strategy & Delivery","To increase the deployment of renewable energy in the UK as cost effectively as possible","Department of Energy and Climate Change","Department of Energy and Climate Change","Energy Markets & Infrastructure","0300 060 4000","correspondence@decc.gsi.gov.uk","9","761959","1","0","0","","Policy","","","http://reference.data.gov.uk/id/department/decc/post/33","/data/decc/2011-09-30/government-staff-and-salary-data---October-11-Final.xls","person29"
"1","Moira Wallace","SCS4","Permanent Secretary","Senior official leading a Government Department","Department of Energy and Climate Change","Department of Energy and Climate Change","Private Office Group","0300 060 4000","correspondence@decc.gsi.gov.uk","XX","718258","1","165000","169999","","Policy","","","http://reference.data.gov.uk/id/department/decc/post/1","/data/decc/2011-09-30/government-staff-and-salary-data---October-11-Final.xls","person2"
"8","Mark Higson","SCS2","CEO, Office for Nuclear Development","Facilitating the deployment of new nuclear power, implementing nuclear waste management policy, including geological disposal.","Department of Energy and Climate Change","Department of Energy and Climate Change","Energy Markets & Infrastructure","0300 060 4000","correspondence@decc.gsi.gov.uk","2","232542","0.78","85000","89999","","Policy","","","http://reference.data.gov.uk/id/department/decc/post/8","/data/decc/2011-09-30/government-staff-and-salary-data---October-11-Final.xls","person9"
"91","N/D","SCS1","Head of News","DECC News","Department of Energy and Climate Change","Department of Energy and Climate Change","Strategy and Evidence Group","0300 060 4000","correspondence@decc.gsi.gov.uk","39","431561","1","0","0","","Communications","","","http://reference.data.gov.uk/id/department/decc/post/91","/data/decc/2011-09-30/government-staff-and-salary-data---October-11-Final.xls","person85"
"82","N/D","SCS1","Head Transport and carbon budget management (Acting)","Implementation of the Climate Change Act 2008. Key projects are: setting the fourth carbon budget (2023-2027); cross-government management of carbon budgets (i.e. is the UK meeting its climate change targets)","Department of Energy and Climate Change","Department of Energy and Climate Change","Strategy and Evidence Group","0300 060 4000","correspondence@decc.gsi.gov.uk","39","N/D","1","0","0","","Policy","","","http://reference.data.gov.uk/id/department/decc/post/82","/data/decc/2011-09-30/government-staff-and-salary-data---October-11-Final.xls","person76"
"20","N/D","SCS1","Head of Carbon Capture & Storage Policy","Developing Carbon Capture & Storage Policy","Department of Energy and Climate Change","Department of Energy and Climate Change","Energy Markets & Infrastructure","0300 060 4000","correspondence@decc.gsi.gov.uk","6","1502185","1","0","0","","Policy","","","http://reference.data.gov.uk/id/department/decc/post/20","/data/decc/2011-09-30/government-staff-and-salary-data---October-11-Final.xls","person19"
"7","Hugo Robson","SCS2","Commercial Director","To work with teams across DECC to improve the commercial viability of DECCs major policies and programmes; lead the Commercial Teams effort to enhance DECCs understanding of our major investors and the capital markets as well as developing DECCs commercial skills and awareness.","Department of Energy and Climate Change","Department of Energy and Climate Change","Energy Markets & Infrastructure","0300 060 4000","correspondence@decc.gsi.gov.uk","2","0","1","140000","144999","","Policy","","","http://reference.data.gov.uk/id/department/decc/post/7","/data/decc/2011-09-30/government-staff-and-salary-data---October-11-Final.xls","person8"
"109","N/D","SCS1","Head of Accreditation and Obligation Frameworks","To develop energy company obligations, property assessments and installation and products for Green Deal","Department of Energy and Climate Change","Department of Energy and Climate Change","International Climate Change and Energy Efficiency","0300 060 4000","correspondence@decc.gsi.gov.uk","80","1213142","1","0","0","","Policy","","","http://reference.data.gov.uk/id/department/decc/post/109","/data/decc/2011-09-30/government-staff-and-salary-data---October-11-Final.xls","person105"
"52","N/D","SCS1","Chief Information Officer","Responsible for strategy, policy and provision of services related to IT, Security, Accommodation, Sustainability and Knowledge and Information Management services to the Department","Department of Energy and Climate Change","Department of Energy and Climate Change","Operations Group","0300 060 4000","correspondence@decc.gsi.gov.uk","40","860196","1","0","0","","Knowledge and Information Management (KIM)","","","http://reference.data.gov.uk/id/department/decc/post/52","/data/decc/2011-09-30/government-staff-and-salary-data---October-11-Final.xls","person48"
"81","Daron Walker","SCS2","Smart Meters, Distributed Energy and Fuel Poverty","Facilitate the transition to low carbon economy through the successful roll out of smart meters to homes and small businesses by 2019, and implementing projects that help more of the lowest income and vulnerable households with the costs of heating their homes.","Department of Energy and Climate Change","Department of Energy and Climate Change","International Climate Change and Energy Efficiency","0300 060 4000","correspondence@decc.gsi.gov.uk","76","193976","1","80000","84999","","Policy","","","http://reference.data.gov.uk/id/department/decc/post/81","/data/decc/2011-09-30/government-staff-and-salary-data---October-11-Final.xls","person75"
"37","Vacant","SCS1","Head of Engineering","To manage Science engineers","Department of Energy and Climate Change","Department of Energy and Climate Change","Strategy and Evidence Group","0300 060 4000","correspondence@decc.gsi.gov.uk","35","0","1","0","0","","Science and Engineering","","","http://reference.data.gov.uk/id/department/decc/post/37","/data/decc/2011-09-30/government-staff-and-salary-data---October-11-Final.xls","person33"
"98","N/D","SCS1","Head of Security of Electricity Supply","To lead on security of electricity supply, including through reform of the electricity market","Department of Energy and Climate Change","Department of Energy and Climate Change","Energy Markets & Infrastructure","0300 060 4000","correspondence@decc.gsi.gov.uk","3","623239","1","0","0","","Policy","","","http://reference.data.gov.uk/id/department/decc/post/98","/data/decc/2011-09-30/government-staff-and-salary-data---October-11-Final.xls","person92"
"54","N/D","SCS1","Deputy Director, Strategy Projects","Flexible project team providing advice on strategy and policy for a secure, cost effective transition to a low carbon economy: as at 30/9/11 undertaking work on the power sector","Department of Energy and Climate Change","Department of Energy and Climate Change","Strategy and Evidence Group","0300 060 4000","correspondence@decc.gsi.gov.uk","39","N/D","1","0","0","","Policy","","","http://reference.data.gov.uk/id/department/decc/post/54","/data/decc/2011-09-30/government-staff-and-salary-data---October-11-Final.xls","person50"
"95","N/D","SCS1","Head of Bill Team","To Develop and deliver a Bill to provide for a step change in the provision of energy efficiency measures to homes and businesses, and make improvements to our framework to enable and secure, low carbon energy supplies and fair competition in the energy markets.","Department of Energy and Climate Change","Department of Energy and Climate Change","Energy Markets & Infrastructure","0300 060 4000","correspondence@decc.gsi.gov.uk","2","628718","1","0","0","","Policy","","","http://reference.data.gov.uk/id/department/decc/post/95","/data/decc/2011-09-30/government-staff-and-salary-data---October-11-Final.xls","person89"
"68","N/D","SCS1","Head of European Policy","To develop European Energy Policy","Department of Energy and Climate Change","Department of Energy and Climate Change","Energy Markets & Infrastructure","0300 060 4000","correspondence@decc.gsi.gov.uk","67","563820","1","0","0","","Policy","","","http://reference.data.gov.uk/id/department/decc/post/68","/data/decc/2011-09-30/government-staff-and-salary-data---October-11-Final.xls","person64"
"13","N/D","SCS1","Head of Delivery, Office of Carbon Capture and Storage","Deliver CCS demonstration projects","Department of Energy and Climate Change","Department of Energy and Climate Change","Energy Markets & Infrastructure","0300 060 4000","correspondence@decc.gsi.gov.uk","6","632733","1","0","0","","Policy","","","http://reference.data.gov.uk/id/department/decc/post/13","/data/decc/2011-09-30/government-staff-and-salary-data---October-11-Final.xls","person13"
"67","Edmund Hosker","SCS2","Director, International, EU and Energy Security","Responsible for International Energy, EU issues and energy security","Department of Energy and Climate Change","Department of Energy and Climate Change","Energy Markets & Infrastructure","0300 060 4000","correspondence@decc.gsi.gov.uk","2","1559771","1","110000","114999","","Policy","","","http://reference.data.gov.uk/id/department/decc/post/67","/data/decc/2011-09-30/government-staff-and-salary-data---October-11-Final.xls","person63"
"79","N/D","SCS1","Head of International Climate Change Strategy, Engagement and Analysis","To co-ordinate cross Whitehall strategy on climate change and engagement with other countries (with FCO) and with business and civil society.","Department of Energy and Climate Change","Department of Energy and Climate Change","International Climate Change and Energy Efficiency","0300 060 4000","correspondence@decc.gsi.gov.uk","66","700779","1","0","0","","Policy","","","http://reference.data.gov.uk/id/department/decc/post/79","/data/decc/2011-09-30/government-staff-and-salary-data---October-11-Final.xls","person73"
"102","N/D","SCS1","Head of Planning and Coordination","Business plan and planning cycle; continuous improvement","Department of Energy and Climate Change","Department of Energy and Climate Change","Operations Group","0300 060 4000","correspondence@decc.gsi.gov.uk","45","N/D","1","0","0","","Policy","","","http://reference.data.gov.uk/id/department/decc/post/102","/data/decc/2011-09-30/government-staff-and-salary-data---October-11-Final.xls","person96"
"35","Paul Hollinshead","SCS2","Director of Science and Innovation","To manage the science and innovation programme that underpins future UK energy security, provides evidence to underpin decision making and contributes to the reduction of the risk of climate change","Department of Energy and Climate Change","Department of Energy and Climate Change","Strategy and Evidence Group","0300 060 4000","correspondence@decc.gsi.gov.uk","34","670672","1","80000","84999","","Science and Engineering","","","http://reference.data.gov.uk/id/department/decc/post/35","/data/decc/2011-09-30/government-staff-and-salary-data---October-11-Final.xls","person31"
"44","N/D","SCS1","Head Strategic Analysis","To provide strategic advice and analysis to support DECC in developing and evaluating policies","Department of Energy and Climate Change","Department of Energy and Climate Change","Strategy and Evidence Group","0300 060 4000","correspondence@decc.gsi.gov.uk","43","875994","1","0","0","","Economics","","","http://reference.data.gov.uk/id/department/decc/post/44","/data/decc/2011-09-30/government-staff-and-salary-data---October-11-Final.xls","person40"
"106","Vacant","SCS1","Chief Technology Officer","Chief Technology Officer","Department of Energy and Climate Change","Department of Energy and Climate Change","International Climate Change and Energy Efficiency","0300 060 4000","correspondence@decc.gsi.gov.uk","97","0","1","0","0","","Policy","","","http://reference.data.gov.uk/id/department/decc/post/106","/data/decc/2011-09-30/government-staff-and-salary-data---October-11-Final.xls","person102"
"103","N/D","SCS1","Head of Better Regulation","Better Regulation and Red Tape Challenge","Department of Energy and Climate Change","Department of Energy and Climate Change","Strategy and Evidence Group","0300 060 4000","correspondence@decc.gsi.gov.uk","43","N/D","1","0","0","","Policy","","","http://reference.data.gov.uk/id/department/decc/post/103","/data/decc/2011-09-30/government-staff-and-salary-data---October-11-Final.xls","person99"
"66","Peter Betts","SCS2","International Climate Change","Leadership of the Governments overall strategy for international action on climate change, including leading in the UN negotiations and on DECCs interest in disbursement of climate finance and in wider influencing.","Department of Energy and Climate Change","Department of Energy and Climate Change","International Climate Change and Energy Efficiency","0300 060 4000","correspondence@decc.gsi.gov.uk","76","441597","1","95000","99999","","Policy","","","http://reference.data.gov.uk/id/department/decc/post/66","/data/decc/2011-09-30/government-staff-and-salary-data---October-11-Final.xls","person62"
"49","N/D","SCS1","Principal Private Secretary","Private Office and Parliamentary Support to Ministers and the Permanent Secretary","Department of Energy and Climate Change","Department of Energy and Climate Change","Private Office Group","0300 060 4000","correspondence@decc.gsi.gov.uk","1","1178361","1","0","0","","Policy","","","http://reference.data.gov.uk/id/department/decc/post/49","/data/decc/2011-09-30/government-staff-and-salary-data---October-11-Final.xls","person45"
"31","N/D","SCS1","Head, Feed-in Tariffs team","Run Feed-in tariffs scheme and carry out review","Department of Energy and Climate Change","Department of Energy and Climate Change","Energy Markets & Infrastructure","0300 060 4000","correspondence@decc.gsi.gov.uk","9","304621","1","0","0","","Policy","","","http://reference.data.gov.uk/id/department/decc/post/31","/data/decc/2011-09-30/government-staff-and-salary-data---October-11-Final.xls","person27"
"51","N/D","SCS1","Deputy Director, Legal: Upstream Energy and CCS","To provide legal advice on Upstream Energy and CCS","Department of Energy and Climate Change","Department of Energy and Climate Change","Operations Group","0300 060 4000","correspondence@decc.gsi.gov.uk","41","373133","1","0","0","","Law","","","http://reference.data.gov.uk/id/department/decc/post/51","/data/decc/2011-09-30/government-staff-and-salary-data---October-11-Final.xls","person47"
"99","N/D","SCS1","Deputy Director Governance and Capability (Acting)","Governance and capability","Department of Energy and Climate Change","Department of Energy and Climate Change","Operations Group","0300 060 4000","correspondence@decc.gsi.gov.uk","45","287217","1","0","0","","Policy","","","http://reference.data.gov.uk/id/department/decc/post/99","/data/decc/2011-09-30/government-staff-and-salary-data---October-11-Final.xls","person93"
"34","David Mackay","SCS3","Chief Scientific Adviser","Ensuring that the Departments policies and operations, and its contributions to wider Government issues, are underpinned by the best science and engineering advice available. The salary shown is not actual as Secondee salaries are not disclosed as part of this exercise, but a representation of the salary for the role.","Department of Energy and Climate Change","Department of Energy and Climate Change","Strategy and Evidence Group","0300 060 4000","correspondence@decc.gsi.gov.uk","1","82900","0.8","105000","109999","","Science and Engineering","","","http://reference.data.gov.uk/id/department/decc/post/34","/data/decc/2011-09-30/government-staff-and-salary-data---October-11-Final.xls","person30"
"101","Mark Pedlingham","SCS2","Strategic Delivery Director, Office of Carbon Capture and Storage","Delivery of CCS Demonstration Programme","Department of Energy and Climate Change","Department of Energy and Climate Change","Energy Markets & Infrastructure","0300 060 4000","correspondence@decc.gsi.gov.uk","6","0","1","105000","109999","","Programme and Project Management (PPM)","","","http://reference.data.gov.uk/id/department/decc/post/101","/data/decc/2011-09-30/government-staff-and-salary-data---October-11-Final.xls","person95"
"92","N/D","SCS1","Head of Heat Strategy and Policy","Responsible for the Govts low carbon heat strategy including policy on heating and cooling in buildings, district and community heating, distributed energy systems and industrial process heat. The team also covers the Standard Assessment Procedure (SAP) measuring building energy performance and Combined Heat and Power (CHP).","Department of Energy and Climate Change","Department of Energy and Climate Change","International Climate Change and Energy Efficiency","0300 060 4000","correspondence@decc.gsi.gov.uk","100","600311","1","0","0","","Policy","","","http://reference.data.gov.uk/id/department/decc/post/92","/data/decc/2011-09-30/government-staff-and-salary-data---October-11-Final.xls","person86"
"36","N/D","SCS1","Head of Science","Science and Analysis","Department of Energy and Climate Change","Department of Energy and Climate Change","Strategy and Evidence Group","0300 060 4000","correspondence@decc.gsi.gov.uk","35","1172263","1","0","0","","Science and Engineering","","","http://reference.data.gov.uk/id/department/decc/post/36","/data/decc/2011-09-30/government-staff-and-salary-data---October-11-Final.xls","person32"
"74","N/D","SCS1","Head of International Negotiations","UK Lead Climate Negotiator/ Climate Negotiations Team","Department of Energy and Climate Change","Department of Energy and Climate Change","International Climate Change and Energy Efficiency","0300 060 4000","correspondence@decc.gsi.gov.uk","66","N/D","1","0","0","","Policy","","","http://reference.data.gov.uk/id/department/decc/post/74","/data/decc/2011-09-30/government-staff-and-salary-data---October-11-Final.xls","person69"
"23","N/D","SCS1","Head of Coal Liabilities","Responsible for the liabilities of the nationalised coal industry in the UK","Department of Energy and Climate Change","Department of Energy and Climate Change","Energy Markets & Infrastructure","0300 060 4000","correspondence@decc.gsi.gov.uk","5","603508","1","0","0","","Policy","","","http://reference.data.gov.uk/id/department/decc/post/23","/data/decc/2011-09-30/government-staff-and-salary-data---October-11-Final.xls","person22"
"32","N/D","SCS1","Head Licensing exploration and Development","Licensing UK's oil and gas and CO2","Department of Energy and Climate Change","Department of Energy and Climate Change","Energy Markets & Infrastructure","0300 060 4000","correspondence@decc.gsi.gov.uk","5","1861392","1","0","0","","Policy","","","http://reference.data.gov.uk/id/department/decc/post/32","/data/decc/2011-09-30/government-staff-and-salary-data---October-11-Final.xls","person28"
"76","Phil Wynn Owen","SCS3","Director General, International Climate Change and Energy Efficiency","Director General with responsibility to encourage the transition to a low-carbon economy, with help for those who need it most.","Department of Energy and Climate Change","Department of Energy and Climate Change","International Climate Change and Energy Efficiency","0300 060 4000","correspondence@decc.gsi.gov.uk","1","921043","1","140000","144999","","Policy","","","http://reference.data.gov.uk/id/department/decc/post/76","/data/decc/2011-09-30/government-staff-and-salary-data---October-11-Final.xls","person70"
"64","N/D","SCS1","Head of Financial Management and Control","Financial Control","Department of Energy and Climate Change","Department of Energy and Climate Change","Operations Group","0300 060 4000","correspondence@decc.gsi.gov.uk","40","1276579","1","0","0","","Finance","","","http://reference.data.gov.uk/id/department/decc/post/64","/data/decc/2011-09-30/government-staff-and-salary-data---October-11-Final.xls","person60"
"73","N/D","SCS1","Head of URENCO Future Options Team","To review and advise on the future options for the UKs shareholding in URENCO","Department of Energy and Climate Change","Department of Energy and Climate Change","Operations Group","0300 060 4000","correspondence@decc.gsi.gov.uk","38","N/D","1","0","0","","Policy","","","http://reference.data.gov.uk/id/department/decc/post/73","/data/decc/2011-09-30/government-staff-and-salary-data---October-11-Final.xls","person68"
"29","N/D","SCS1","Head of Development Consents and Planning Reform (Acting)","Responsible for assessing planning applications for major energy proposals including power stations and overhead lines, and advising on the energy National Policy Statements.","Department of Energy and Climate Change","Department of Energy and Climate Change","Energy Markets & Infrastructure","0300 060 4000","correspondence@decc.gsi.gov.uk","5","878337","1","0","0","","Policy","","","http://reference.data.gov.uk/id/department/decc/post/29","/data/decc/2011-09-30/government-staff-and-salary-data---October-11-Final.xls","person25"
"100","Stephen Martin","SCS2","Director, Heat & Industry","Developing a long-term strategy for reducing emissions from heating. Supporting the deployment of renewable heat production. Improving energy efficiency and reducing emissions of large energy users, while maintaining UK industrial competitiveness.","Department of Energy and Climate Change","Department of Energy and Climate Change","International Climate Change and Energy Efficiency","0300 060 4000","correspondence@decc.gsi.gov.uk","76","0","1","85000","89999","","Policy","","","http://reference.data.gov.uk/id/department/decc/post/100","/data/decc/2011-09-30/government-staff-and-salary-data---October-11-Final.xls","person94"
"83","N/D","SCS1","Head, Strategy and Delivery, Energy Efficiency Deployment Office","To improve energy efficiency across the UK economy.","Department of Energy and Climate Change","Department of Energy and Climate Change","International Climate Change and Energy Efficiency","0300 060 4000","correspondence@decc.gsi.gov.uk","76","N/D","1","0","0","","Policy","","","http://reference.data.gov.uk/id/department/decc/post/83","/data/decc/2011-09-30/government-staff-and-salary-data---October-11-Final.xls","person77"
"107","Vacant","SCS1","Commercial","Commercial","Department of Energy and Climate Change","Department of Energy and Climate Change","International Climate Change and Energy Efficiency","0300 060 4000","correspondence@decc.gsi.gov.uk","97","0","1","0","0","","Policy","","","http://reference.data.gov.uk/id/department/decc/post/107","/data/decc/2011-09-30/government-staff-and-salary-data---October-11-Final.xls","person103"
"19","N/D","SCS1","Head of New Nuclear and Strategy","To enable new nuclear build in the UK","Department of Energy and Climate Change","Department of Energy and Climate Change","Energy Markets & Infrastructure","0300 060 4000","correspondence@decc.gsi.gov.uk","8","698372","1","0","0","","Policy","","","http://reference.data.gov.uk/id/department/decc/post/19","/data/decc/2011-09-30/government-staff-and-salary-data---October-11-Final.xls","person18"
"40","Vanessa Howlison","SCS2","Finance Director","Responsible for ensuring that DECC manages its resources effectively and gets good value for money for the taxpayer.","Department of Energy and Climate Change","Department of Energy and Climate Change","Operations Group","0300 060 4000","correspondence@decc.gsi.gov.uk","38","N/D","1","125000","129999","","Finance","","","http://reference.data.gov.uk/id/department/decc/post/40","/data/decc/2011-09-30/government-staff-and-salary-data---October-11-Final.xls","person36"
"97","Robert Turner","SCS2","Smart Meters","To lead the Smart Meter Programme and deliver the required outcomes of Stage 2 (Foundation stage)","Department of Energy and Climate Change","Department of Energy and Climate Change","International Climate Change and Energy Efficiency","0300 060 4000","correspondence@decc.gsi.gov.uk","76","0","1","110000","114999","","Policy","","","http://reference.data.gov.uk/id/department/decc/post/97","/data/decc/2011-09-30/government-staff-and-salary-data---October-11-Final.xls","person91"
"45","Louise Dominion","SCS2","Planning and Performance Director (Acting)","Ensures effective DECC planning & performance reporting","Department of Energy and Climate Change","Department of Energy and Climate Change","Operations Group","0300 060 4000","correspondence@decc.gsi.gov.uk","38","N/D","1","80000","84999","","Programme and Project Management (PPM)","","","http://reference.data.gov.uk/id/department/decc/post/45","/data/decc/2011-09-30/government-staff-and-salary-data---October-11-Final.xls","person41"
"57","N/D","SCS1","Deputy Director, Strategy","Flexible project team providing advice on strategy and policy for a secure, cost effective transition to a low carbon economy: as at 14/11/11 undertaking work on DECCs Carbon Plan and 2050 Costs Calculator","Department of Energy and Climate Change","Department of Energy and Climate Change","Strategy and Evidence Group","0300 060 4000","correspondence@decc.gsi.gov.uk","39","N/D","1","0","0","","Policy","","","http://reference.data.gov.uk/id/department/decc/post/57","/data/decc/2011-09-30/government-staff-and-salary-data---October-11-Final.xls","person53"
"62","N/D","SCS1","Deputy Director, Strategy Projects","Flexible project team providing advice on strategy and policy for a secure, cost effective transition to a low carbon economy: as at 30/9/11 undertaking work on the buildings and industry sectors","Department of Energy and Climate Change","Department of Energy and Climate Change","Strategy and Evidence Group","0300 060 4000","correspondence@decc.gsi.gov.uk","39","N/D","1","0","0","","Policy","","","http://reference.data.gov.uk/id/department/decc/post/62","/data/decc/2011-09-30/government-staff-and-salary-data---October-11-Final.xls","person58"
