"Post Unique Reference","Name","Grade (or equivalent)","Job Title","Job/Team Function","Parent Department","Organisation","Unit","Contact Phone","Contact E-mail","Reports to Senior Post","Salary Cost of Reports (£)","FTE","Actual Pay Floor (£)","Actual Pay Ceiling (£)","","Professional/Occupational Group","Notes","Valid?","URI","source_file","source_line"
"1","Helen Hughes","SCS3","Interim Chief Executive and Accounting Officer","Chief Executive and Accounting Officer, reporting to the Chair and the Secretary of State. Has responsibility under authority delegated by the Board, for the overall organisation, management and staffing for the Commission and for its procedures in financial and other matters, including conduct and discipline.","Government Equalities Office","Equality and Human Rights Commission","Commissioner's Office","0203 1170235","chiefexecutive@equalityhumanrights.com","XX","2200000","1","130000","134999","","Operational Delivery","","","http://reference.data.gov.uk/id/public-body/commission-for-equalities-and-human-rights-known-a/post/1","/data/equalityhumanrights/2011-03-31/EHRC-Copy-of-government-staff-and-salary-data-FINAL-20110607v5.xls","person2"
"4","Sheila Kumar","SCS2","Group Director - Regulation","Group Director - Regulation reporting to the Chief Executive and Accounting Officer. Responsible for developing the structures and processes to transform the CEHR into a modern regulator and guide the exercise of its regulatory functions.","Government Equalities Office","Equality and Human Rights Commission","Strategy, Group Directorate","0203 1170235","seniormanagement@equalityhumanrights.com","1","2800000","1","105000","109999","","Operational Delivery","","","http://reference.data.gov.uk/id/public-body/commission-for-equalities-and-human-rights-known-a/post/4","/data/equalityhumanrights/2011-03-31/EHRC-Copy-of-government-staff-and-salary-data-FINAL-20110607v5.xls","person5"
"3","Julie Anderson","SCS2","Group Director - Corporate Management","Group Director - Corporate Management reporting to the Chief Executive and Accounting Officer. Leads the management of change, acts as strategic facilitator to establish the CEHR and embed a high performance culture. Also responsible for the provision of operational services across the organisation.","Government Equalities Office","Equality and Human Rights Commission","Corporate Management, Group Directorate","0203 1170235","seniormanagement@equalityhumanrights.com","1","3500000","1","95000","99999","","Operational Delivery","","","http://reference.data.gov.uk/id/public-body/commission-for-equalities-and-human-rights-known-a/post/3","/data/equalityhumanrights/2011-03-31/EHRC-Copy-of-government-staff-and-salary-data-FINAL-20110607v5.xls","person4"
"2","Richard Emmott","SCS2","Interim Group Director - Communications","Group Director - Communications reporting to the Chief Executive and Accounting Officer. Leads the communications team to drive the national agenda on equality and human rights. Also has a critical role of ensuring the CEHR can deliver its stakeholder engagement strategy.","Government Equalities Office","Equality and Human Rights Commission","Communications, Group Directorate","0203 1170235","seniormanagement@equalityhumanrights.com","1","2800000","1","180000","184999","","Operational Delivery","","","http://reference.data.gov.uk/id/public-body/commission-for-equalities-and-human-rights-known-a/post/2","/data/equalityhumanrights/2011-03-31/EHRC-Copy-of-government-staff-and-salary-data-FINAL-20110607v5.xls","person3"
"5","John Wadham","SCS2","Group Director - Legal","Group Director Legal, reporting to the Chief Executive, guides the Commission on its statutory powers and duties and their use in pursuit of the Commission's objectives. Leads on the enforcement activity of all individual strategic cases .","Government Equalities Office","Equality and Human Rights Commission","Legal, Group Directorate","0203 1170235","seniormanagement@equalityhumanrights.com","1","2500000","1","120000","124999","","Operational Delivery","","","http://reference.data.gov.uk/id/public-body/commission-for-equalities-and-human-rights-known-a/post/5","/data/equalityhumanrights/2011-03-31/EHRC-Copy-of-government-staff-and-salary-data-FINAL-20110607v5.xls","person6"
