"Post Unique Reference","Name","Grade (or equivalent)","Job Title","Job/Team Function","Parent Department","Organisation","Unit","Contact Phone","Contact E-mail","Reports to Senior Post","Salary Cost of Reports (£)","FTE","Actual Pay Floor (£)","Actual Pay Ceiling (£)","","Professional/Occupational Group","Notes","Valid?","URI","source_file","source_line"
"260-DOCC1","David Knight","SCS1","Director Of Casework and Customer Services","The Director of Casework and Customer Services is responsible for the staff who make decisions on appeals made by members of the public, the Telephone Complaints Centre and the Freedom of Information team.","Home Office","Independent Police Complaints Commission","Casework and Customer Services Directorate","08453 002 002","N/D","610-CEO1","4649306","1","80000","84999","","","","","http://reference.data.gov.uk/id/public-body/independent-police-complaints-commission/post/260-DOCC1","/data/ipcc/2011-09-30/IPCC-Template-November-2011.xls","person4"
"610-CEO1","Jane Furniss","SCS2","Chief Executive","The IPCC's Chief Executive is the IPCC's Accounting Officer and is accountable to the Home Office Principal Accounting Officer and to Parliament. She is responsible for running the organisation which supports the work of the Commission.","Home Office","Independent Police Complaints Commission","Chief Executive's Private Office and Commission Secretariat","08453 002 002","N/D","XX","836494","1","130000","134999","","","","","http://reference.data.gov.uk/id/public-body/independent-police-complaints-commission/post/610-CEO1","/data/ipcc/2011-09-30/IPCC-Template-November-2011.xls","person2"
"280-DOQS1","Mike Benbow","SCS1","Director of Standards & Quality","The Director of Standards and Quality is responsible for the directorate which leads on standards, quality assurance, risk management, operational training and performance data.","Home Office","Independent Police Complaints Commission","Standards and Quality Standards Directorate","08453 002 002","N/D","610-CEO1","1035123","1","75000","79999","","","","","http://reference.data.gov.uk/id/public-body/independent-police-complaints-commission/post/280-DOQS1","/data/ipcc/2011-09-30/IPCC-Template-November-2011.xls","person5"
"270-DOI1","Moir Stewart","SCS1","Director of Investigations","The Director of Investigations is responsible for the directorate which investigates the most serious complaints and allegations of misconduct against the police in England and Wales.","Home Office","Independent Police Complaints Commission","Investigations Directorate","08453 002 002","N/D","610-CEO1","6353330","1","105000","109999","","","","","http://reference.data.gov.uk/id/public-body/independent-police-complaints-commission/post/270-DOI1","/data/ipcc/2011-09-30/IPCC-Template-November-2011.xls","person6"
"110-DCLS1","Amanda Kelly","SCS1","Director Of Business Services","The Director of Business Services is responsible for running the directorate which provides Finance, Human Resources, Procurement, IT, Facilities Management and Legal services to the organisation. As well as assisting the organisation with policy development, press and public relations.","Home Office","Independent Police Complaints Commission","Business Services Directorate","08453 002 002","N/D","610-CEO1","4190606","1","95000","99999","","","","","http://reference.data.gov.uk/id/public-body/independent-police-complaints-commission/post/110-DCLS1","/data/ipcc/2011-09-30/IPCC-Template-November-2011.xls","person3"
