"Post Unique Reference","Name","Grade (or equivalent)","Job Title","Job/Team Function","Parent Department","Organisation","Unit","Contact Phone","Contact E-mail","Reports to Senior Post","Salary Cost of Reports (£)","FTE","Actual Pay Floor (£)","Actual Pay Ceiling (£)","","Professional/Occupational Group","Notes","Valid?","URI","source_file","source_line"
"JAC1","Christopher Stephens","SCS3","Chair","Whilst for programming reasons the 'grade' of this individual is shown as 'SCS', in fact they are a public appointee and not a civil servant. Non-executive chair of the Judicial Appointments Commission. Responsible for the reviewing the Department's strategic direction, in conjunction with 14 other Commissioners.","Ministry of Justice","Judicial Appointments Commission","Corporate office","020 33340463","Christopher.Stephens@jac.gsi.gov.uk","XX","0","0.6","55000","59999","","Operational Delivery","","","http://reference.data.gov.uk/id/public-body/judicial-appointments-commission/post/JAC1","/data/JAC/2011-03-31/JAC-upload-v2.2.xls","person2"
"JAC3","","SCS1","Director - Courts Appointments","Director of Court Appointments. Primarily responsible for the management of the selection exercises relating to judiciary appointments to courts.","Ministry of Justice","Judicial Appointments Commission","Courts Appointments","020 33340453","enquiries@jac.gsi.gov.uk","JAC2","797455","1","0","0","","Operational Delivery","","","http://reference.data.gov.uk/id/public-body/judicial-appointments-commission/post/JAC3","/data/JAC/2011-03-31/JAC-upload-v2.2.xls","person4"
"JAC5","","SCS1","Director - Operational Services","Director of Operational Services. Primarily responsible for supporting the selection exercise programme through operational services such as making interview arrangements and functions such as overall selection exercise programme management. Also responsible for human resources, business services, outreach to candidates for judicial appointments, research and selection policy, including selection of panellists and putting equality and fair treatement at the heart of the JAC and its selection policies. Responsible for official statistics and the operation of the Commission secreatriat.","Ministry of Justice","Judicial Appointments Commission","Operational Services","020 33340453","enquiries@jac.gsi.gov.uk","JAC2","973742","1","0","0","","Operational Delivery","","","http://reference.data.gov.uk/id/public-body/judicial-appointments-commission/post/JAC5","/data/JAC/2011-03-31/JAC-upload-v2.2.xls","person6"
"JAC2","Nigel Reeder","SCS2","Chief Executive","The Judicial Appointments Commission (JAC) is an independent commission that selects candidates for judicial office in courts and tribunals in England and Wales, and for some tribunals whose jurisdiction extends to Scotland or Northern Ireland.","Ministry of Justice","Judicial Appointments Commission","Corporate office","020 33340570","Nigel.Reeder@jac.gsi.gov.uk","JAC1","271083","1","85000","89999","","Operational Delivery","","","http://reference.data.gov.uk/id/public-body/judicial-appointments-commission/post/JAC2","/data/JAC/2011-03-31/JAC-upload-v2.2.xls","person3"
"JAC4","","SCS1","Director - Tribunal Appointments & Corporate Accounting and Planning","Director of Tribunal Appointments. Responsible for the management of selection exercises relating to judiciary appointments to Tribunals.","Ministry of Justice","Judicial Appointments Commission","Tribunal Appointments","020 33340453","enquiries@jac.gsi.gov.uk","JAC2","824927","1","0","0","","Operational Delivery","","","http://reference.data.gov.uk/id/public-body/judicial-appointments-commission/post/JAC4","/data/JAC/2011-03-31/JAC-upload-v2.2.xls","person5"
