"Post Unique Reference","Name","Grade (or equivalent)","Job Title","Job/Team Function","Parent Department","Organisation","Unit","Contact Phone","Contact E-mail","Reports to Senior Post","Salary Cost of Reports (£)","FTE","Actual Pay Floor (£)","Actual Pay Ceiling (£)","","Professional/Occupational Group","Notes","Valid?","URI","source_file","source_line"
"7","Maxine Carden","SCS2","Director (Human Resources)","Responsible for developing and delivering HR strategies alligned with business requirements.","Department for Culture, Media and Sport","National Museums Liverpool","Human Resources","0151 478 4677","maxine.carden@liverpoolmuseums.org.uk","1","373908","1","50000","54999","","Human Resources","","","http://reference.data.gov.uk/id/public-body/national-museums-liverpool/post/7","/data/liverpoolmuseums/2011-09-30/300911-NML.xls","person8"
"5","Carol Rogers","SCS2","Executive Director (Education, Communities & Visitors)","Directs the Education Division, in the strategic planning and delivery of formal, informal and outreach learning programmes based on and relating to the collections on display across all NML's venues and oversees the delivery of front of house services across the organisation.","Department for Culture, Media and Sport","National Museums Liverpool","Education,Communities and Visitors","0151 478 4123","carol.rogers@liverpoolmuseums.org.uk","1","4539043","1","65000","69999","","Programme and Project Management (PPM)","","","http://reference.data.gov.uk/id/public-body/national-museums-liverpool/post/5","/data/liverpoolmuseums/2011-09-30/300911-NML.xls","person6"
"4","Amy de Joia","SCS2","Exectutive Director (Development & Communications)","Responsible for fundraising, marketing and communications, exhibitions, museum partnerships and the development of the catering, retail and conference business run by NML Trading Ltd","Department for Culture, Media and Sport","National Museums Liverpool","Development and Communications","0151 478 4962","amy.dejoia@liverpoolmuseums.org.uk","1","1381807","1","70000","74999","","Programme and Project Management (PPM)","","","http://reference.data.gov.uk/id/public-body/national-museums-liverpool/post/4","/data/liverpoolmuseums/2011-09-30/300911-NML.xls","person5"
"3","Sharon Granville","SCS2","Project director (Museum of Liverpool)","Currently leading the new multi million pound Museum of Liverpool project, as well as managing the departments of Urban History and Estate Management","Department for Culture, Media and Sport","National Museums Liverpool","Museum of Liverpool","0151 478 4236","sharon.granville@liverpoolmuseums.org.uk","1","1736924","1","70000","74999","","Programme and Project Management (PPM)","","","http://reference.data.gov.uk/id/public-body/national-museums-liverpool/post/3","/data/liverpoolmuseums/2011-09-30/300911-NML.xls","person4"
"6","Anthony Allen","SCS2","Executive Director (Finance)","Responsible for all financial forecasting and budgeting, reporting to financial and audit committes. Oversee's NML's Information Services and Audit functions.","Department for Culture, Media and Sport","National Museums Liverpool","Finance","0151 478 4638","tony.allen@liverpoolmuseums.org.uk","1","909486","1","60000","64999","","Finance","","","http://reference.data.gov.uk/id/public-body/national-museums-liverpool/post/6","/data/liverpoolmuseums/2011-09-30/300911-NML.xls","person7"
"1","David Fleming","SCS3","Director of National Museums","Director of National Museums Liverpool","Department for Culture, Media and Sport","National Museums Liverpool","NA","0151 478 4201","david.fleming@liverpoolmuseums.org.uk","XX","122009","1","105000","109999","","Programme and Project Management (PPM)","","","http://reference.data.gov.uk/id/public-body/national-museums-liverpool/post/1","/data/liverpoolmuseums/2011-09-30/300911-NML.xls","person2"
"2","Vacant","SCS2","Executive Director (Collections Management)","Responsible for NML's public venues venues and collections.","Department for Culture, Media and Sport","National Museums Liverpool","Collections Management","N/A","N/A","1","0","1","0","0","","Programme and Project Management (PPM)","","","http://reference.data.gov.uk/id/public-body/national-museums-liverpool/post/2","/data/liverpoolmuseums/2011-09-30/300911-NML.xls","person3"
