"Post Unique Reference","Name","Grade (or equivalent)","Job Title","Job/Team Function","Parent Department","Organisation","Unit","Contact Phone","Contact E-mail","Reports to Senior Post","Salary Cost of Reports (£)","FTE","Actual Pay Floor (£)","Actual Pay Ceiling (£)","","Professional/Occupational Group","Notes","Valid?","URI","source_file","source_line"
"PINS02","NA","SCS1","Director of Development Plans ,Policy and Quality","Responsible for the management of local development plans, policy and maintaining the professional standards of the Inspector workforce.","Department for Communities and Local Government","Planning Inspectorate","Development Plans, Policy and Quality","0117 372 8958","Karen.Jones@pins.gsi.gov.uk","PINS01","3281983","1","0","0","","Planning","","","http://reference.data.gov.uk/id/public-body/the-planning-inspectorate/post/PINS02","/data/communities/2011-09-30/Copy-of-government-staff-and-salary-data-blank-template---October-2011.xls","person3"
"PINS04","NA","SCS1","Director of Casework","Director of Casework - responsible for the management and timely delivery of c. 24,000 appeal decisions per annum on planning, enforcement, environmental, transport, costs and other specialist appeals. Responsible for over 200 inspectors and 180 administration staff.","Department for Communities and Local Government","Planning Inspectorate","Casework","0117 372 8616","kim.may@pins.gsi.gov.uk","PINS01","12387750","1","0","0","","Planning","","","http://reference.data.gov.uk/id/public-body/the-planning-inspectorate/post/PINS04","/data/communities/2011-09-30/Copy-of-government-staff-and-salary-data-blank-template---October-2011.xls","person5"
"PINS05","NA","SCS1","Director for Wales","Director of Wales - responsible for the management and timely delivery of c. 1500 appeal decisions per annum on planning, enforcement, environmental, transport, costs and other specialist appeals. Responsible for 15 inspectors and 22 administration staff.","Department for Communities and Local Government","Planning Inspectorate","Wales","02920 823866","lucy.erwood@pins.gsi.gov.uk","PINS01","1264024","1","0","0","","Planning","","","http://reference.data.gov.uk/id/public-body/the-planning-inspectorate/post/PINS05","/data/communities/2011-09-30/Copy-of-government-staff-and-salary-data-blank-template---October-2011.xls","person6"
"PINS03","NA","SCS1","Director of Finance, Resources and Business Planning","Director responsible for the management of Human Resources, Information ServicesFinance and Business Planning","Department for Communities and Local Government","Planning Inspectorate","Finance, Resource and Business Planning","0117 372 8392","julie.cook@pins.gsi.gov.uk","PINS01","4523446","1","0","0","","Finance","","","http://reference.data.gov.uk/id/public-body/the-planning-inspectorate/post/PINS03","/data/communities/2011-09-30/Copy-of-government-staff-and-salary-data-blank-template---October-2011.xls","person4"
"PINS01","Sir Michael Pitt","SCS2","Chief Executive","Chief Executive of the Planning Inspectorate - Appointment by the Secretary of State","Department for Communities and Local Government","Planning Inspectorate","Chief Executive","0117 372 8965","Shelia.richards@pins.gsi.gov.uk","XX","0","0.5","0","0","","Planning","","","http://reference.data.gov.uk/id/public-body/the-planning-inspectorate/post/PINS01","/data/communities/2011-09-30/Copy-of-government-staff-and-salary-data-blank-template---October-2011.xls","person2"
