"Post Unique Reference","Name","Grade (or equivalent)","Job Title","Job/Team Function","Parent Department","Organisation","Unit","Contact Phone","Contact E-mail","Reports to Senior Post","Salary Cost of Reports (£)","FTE","Actual Pay Floor (£)","Actual Pay Ceiling (£)","","Professional/Occupational Group","Notes","Valid?","URI","source_file","source_line"
"INSS2","Les Cramp","SCS2","Deputy Chief Executive","Responsible for Corporate and Workplace Services (The Service's IT, Estates and Procurement functions); Business Services Directorate (The Redundancy Payments Service, Estate Accounting Services and Insolvency Practitioner Regulation); and the Policy Directorate.","Department for Business Innovation and Skills","The Insolvency Service","Corporate and Business Services","0207 637 1110","les.cramp@insolvency.gsi.gov.uk","INSS1","11570164","1","95000","99999","","Operational Delivery","","","http://reference.data.gov.uk/id/public-body/the-insolvency-service/post/INSS2","/data/insolvency/2011-03-31/INSS-SCS-Organogram-and-staffing-details.xls","person3"
"INSS4","Robert Burns","SCS1","Inspector of Companies","Investigation into the conduct of bankrupts and company directors and the punishment/prosecution of those suspected of misconduct.","Department for Business Innovation and Skills","The Insolvency Service","Investigations and Enforcement","0207 637 1110","robert.burns@insolvency.gsi.gov.uk","INSS1","13994474","1","85000","89999","","Operational Delivery","","","http://reference.data.gov.uk/id/public-body/the-insolvency-service/post/INSS4","/data/insolvency/2011-03-31/INSS-SCS-Organogram-and-staffing-details.xls","person5"
"INSS5","Anne Willcocks","SCS1","Head of Policy","To ensure that insolvency law is kept up to date and fit for purpose; support Ministers on domestic, European Union and international insolvency issues; also to provide advice to official receivers and insolvency practitioners as to the practical application of the insolvency law. To provide National Statistics as well as other statistical analysis on insolvency.","Department for Business Innovation and Skills","The Insolvency Service","Policy","0207 637 1110","policy.unit@insolvency.gsi.gov.uk","INSS2","2328098","0.8","85000","89999","","Policy","","","http://reference.data.gov.uk/id/public-body/the-insolvency-service/post/INSS5","/data/insolvency/2011-03-31/INSS-SCS-Organogram-and-staffing-details.xls","person6"
"INSS3","Graham Horne","SCS2","Deputy Inspector General","The administration of bankruptcies and debt relief orders, the compulsory winding up of companies and investigation into misconduct","Department for Business Innovation and Skills","The Insolvency Service","Official Receiver Services","0207 637 1110","graham.horne@insolvency.gsi.gov.uk","INSS1","39762309","1","90000","94999","","Operational Delivery","","","http://reference.data.gov.uk/id/public-body/the-insolvency-service/post/INSS3","/data/insolvency/2011-03-31/INSS-SCS-Organogram-and-staffing-details.xls","person4"
"INSS1","Stephen Speed","SCS2","Inspector General & Agency Chief Executive","Oversees an organisation of around 2150 staff in 36 locations across the country who administer bankruptcies and the compulsory winding up of companies; the conduct of bankrupts and company directors; as well as making statutory redundancy and other payments to staff made redundant by employers who cannot or will not pay. Heads of Strategy, Planning & Communication, and Finance & Corporate Governance report directly to the Chief Executive.","Department for Business Innovation and Skills","The Insolvency Service","Strategy, Planning & Communication and Finance & Corporate Governance","0207 637 1110","stephen.speed@insolvency.gsi.gov.uk","XX","3319459","1","95000","99999","","Operational Delivery","","","http://reference.data.gov.uk/id/public-body/the-insolvency-service/post/INSS1","/data/insolvency/2011-03-31/INSS-SCS-Organogram-and-staffing-details.xls","person2"
