106,179598,Jonathan Slater,SCS3,DG Transformation & Corporate Strategy,"Leadership of (1) implementing the radical reform of the Ministry of Defence, and (2) managing the portfolio of programmes arising from the 2010 Strategic Defence & Security Review. Also Top Level Budget Holder for the Ministry’s Head Office & Corporate Services.",Ministry of Defence,Ministry of Defence,Head Office and Corporate Services,0207 218 9507,HOCSFIN-HeadGroupMailbox@mod.uk,00005654,0.0,1.0,145000,149999,0,Programme and Project Management (PPM),,1
107,199327,Maj Gen Peter Fox,OF-7,Director Customer Design Team,Designing and implementing the customer design programme to improve equipment acquisition and support in defence.,Ministry of Defence,Ministry of Defence,Head Office and Corporate Services,0207 218 9507,HOCSFIN-HeadGroupMailbox@mod.uk,00179598,0.0,1.0,110000,114999,0,Programme and Project Management (PPM),,1
108,199365,N/D,OF-6,"HD of Requestor Design, Customer Design Team",Head of requestor design for the customer design programme,Ministry of Defence,Ministry of Defence,Head Office and Corporate Services,0207 218 9507,HOCSFIN-HeadGroupMailbox@mod.uk,00199327,0.0,1.0,0,0,0,Programme and Project Management (PPM),,1
109,199366,N/D,SCS1,"HD of Governor Design, Customer Design Team",Head of governor design for the customer design programme,Ministry of Defence,Ministry of Defence,Head Office and Corporate Services,0207 218 9507,HOCSFIN-HeadGroupMailbox@mod.uk,00199327,0.0,1.0,0,0,0,Programme and Project Management (PPM),,1
110,0,N/D,SCS1,Not in Post,Not in Post,Ministry of Defence,Ministry of Defence,Head Office and Corporate Services,,HOCSFIN-HeadGroupMailbox@mod.uk,00106000,0.0,1.0,0,0,0,Finance,,1
111,1062831,N/D,OF-6,Air Attaché,"Performs the duties of both the Air Attaché and the Assistant Defence Attaché in Washington. Provides Her Majesty’s Ambassador and the Defence Attaché with specialist advice on all air, space and cyberspace power matters. Responsibilities include playing a key role in fostering close engagement with the air arms of each of the US Forces, in particular their air, space and cyberspace related elements. Ensuring maximum interoperability between the UK and US Armed Forces, so that when the UK undertakes any form of military operation with the US we can operate together efficiently, effectively and with trust.",Ministry of Defence,Ministry of Defence,Head Office and Corporate Services,0207 218 9507,HOCSFIN-HeadGroupMailbox@mod.uk,1062827,0.0,1.0,0,0,0,Military,,1
112,196733,Rear Admiral John Gower,OF-7,Assistant Chief of Defence Staff (Nuclear and Chemical and Biological),"formulation of strategic planning advice to COS and ministers, MOD’s 2* policy lead for CBRN, and Arms, Counter Proliferation.   
",Ministry of Defence,Ministry of Defence,Head Office and Corporate Services,0207 218 9507,HOCSFIN-HeadGroupMailbox@mod.uk,140333,0.0,1.0,110000,114999,0,Military,,1
113,1055692,Maj General Patrick Sanders,OF-7,Assistant Chief of Defence Staff Operations,"Operational strategy and planning; direction and conduct of operations at the strategic level; maintenance of policy context for planning and conduct of operations; Defence Crisis Management Organisation process;Joint Capability; Middle East/Central America/South America (inc Peru, Colombia, Ecuador, Venezuela)           ",Ministry of Defence,Ministry of Defence,Head Office and Corporate Services,0207 218 9507,HOCSFIN-HeadGroupMailbox@mod.uk,1055683,0.0,1.0,110000,114999,0,Military,,1
114,144814,N/D,SCS1,Counsellor Defence Acquisition and Technology,"Responsible for the management and direction of a team of civilian and military staff organized as a Defence Equipment team, a Science and Technology team and a Command, Control, Communications, Computers, Intelligence, Surveillance and Reconnaissance (C4ISR) team. Together their responsibilities include: support to operations; delivery of a step change in the US-UK science and technology relationship; development of the US-UK Bilateral Defence Acquisition Committee; support to UK capability procurement and development; and support to UKTI objectives for the US.",Ministry of Defence,Ministry of Defence,Head Office and Corporate Services,0207 218 9507,HOCSFIN-HeadGroupMailbox@mod.uk,1062827,0.0,1.0,0,0,0,Policy,,1
115,144816,N/D,SCS1,Counsellor Defence Policy and Nuclear,"Responsible for management and direction of a civilian and military staff organized as a Defence Policy Team and a Nuclear Strategic Deterrent and Chemical Biological and Radiological Defence (NSD & CBRD) Team. The Defence Policy Team promotes cooperation and dialogue with the
US defence community on strategic defence and national security issues and supports policy work on current military operations issues. The NSD & CBRD Team supports US/UK collaboration on nuclear deterrence; weapon stockpile reduction, testing and compliance and threat reduction; as well as, collaboration on chemical, biological, radiological,nuclear defence; and dialogue on ballistic missile defence.",Ministry of Defence,Ministry of Defence,Head Office and Corporate Services,0207 218 9507,HOCSFIN-HeadGroupMailbox@mod.uk,1062827,0.0,1.0,0,0,0,Policy,,1
116,1055683,Lieutenant General James Everard,OF-8,Deputy Chief of Defence Staff (Military Strategic Operations),"Director of Operations. Joint responsibility (with DG Sec Pol for delivering strategy and planning for operations, directs and conducts operations at the strategic level)",Ministry of Defence,Ministry of Defence,Head Office and Corporate Services,0207 218 9507,HOCSFIN-HeadGroupMailbox@mod.uk,00109715,0.0,1.0,125000,129999,0,Military,,1
117,1128589,Vacant,OF-6,Deputy Director Combined Joint Operations from the Sea Centre of Excellence,"The Deputy Director (DDir) of CJOS COE is responsible for the daily operations, development and production of the Centre’s Programme of Work, and its future vision.  As the Director is dual hatted with Commander Second Fleet, the DDir generally takes the commanding role.  He forges close links with ACT, NATO commands and authorities, international organizations (including the UN), NATO national authorities as well as academic institutions in order to deliver the Centres’ extensive Programme.  He also takes a lead role in promoting UK military interests in the Norfolk area including supporting visits of UK ships and senior personnel.  CJOS COE is a joint and combined MOU-based organization with IMO status.  It is a source of maritime expertise on all aspects of NATO transformation of joint expeditionary operations from the sea to the sponsoring nations.  It is made up of 32 personnel from 13 NATO nations.",Ministry of Defence,Ministry of Defence,Head Office and Corporate Services,,HOCSFIN-HeadGroupMailbox@mod.uk,1062827,0.0,1.0,0,0,0,Military,,1
118,189101,N/D,SCS1,Head DIU Pol And Disclosure Unit,"Policy on judicial and external scrutiny of MOD business, Policy & Disclosure   ",Ministry of Defence,Ministry of Defence,Head Office and Corporate Services,0207 218 9507,HOCSFIN-HeadGroupMailbox@mod.uk,188553,0.0,1.0,0,0,0,Policy,,1
119,180361,N/D,SCS1,Head Public Inquiries,"Policy on judicial and external scrutiny of MOD business, public enquiries  ",Ministry of Defence,Ministry of Defence,Head Office and Corporate Services,0207 218 9507,HOCSFIN-HeadGroupMailbox@mod.uk,188553,0.0,1.0,0,0,0,Policy,,1
120,1570344,N/D,OF-6,Head Ops Directorate Military Strategic Effects,"Direction and conduct of current and future operations at the strategic level by providing advice and coordination of MOD Targeting, Information Operations (IO), Computer Network Operations (CNO) and Special Capability efforts, policy and capability development.",Ministry of Defence,Ministry of Defence,Head Office and Corporate Services,0207 218 9507,HOCSFIN-HeadGroupMailbox@mod.uk,142008,0.0,1.0,0,0,0,Military,,1
121,1131246,N/D,OF-6,Military Attaché,"The Military Attaché provides Army-focused, military advice to Her Majesty’s Ambassador and the Defence Attaché and is the representative in the United States of the Chief of the General Staff of the British Army, providing an essential link at the highest level between the U.S. Army and the British Army.",Ministry of Defence,Ministry of Defence,Head Office and Corporate Services,0207 218 9507,HOCSFIN-HeadGroupMailbox@mod.uk,1062827,0.0,1.0,0,0,0,Military,,1
122,144805,Will Jessett,SCS2,Minister (Defence Materiel),"The senior Ministry of Defence Civil Servant in the United States. As Civil Secretary, he has responsibility for financial management governance of the BDS-US budget. As Minister (Defence Materiel), he is responsible to HMA for all aspects of the UK/US defence equipment acquisition, technology and logistics policy, programmes and process.",Ministry of Defence,Ministry of Defence,Head Office and Corporate Services,0207 218 9507,HOCSFIN-HeadGroupMailbox@mod.uk,1062827,0.0,1.0,80000,84999,0,Policy,,1
123,1131246,N/D,OF-6,Naval Attaché,"The Naval Attaché and his staff act as the principal advisers on maritime matters to Her Majesty's Ambassador and the Defence Attaché; represent the Royal Navy and Ministry of Defence (Navy) in the US; act as principal points of contact between the UK Ministry of Defence and the US Chief of Naval Operations, US Marine Corps and the US Coast Guard Service; and oversee arrangements for Royal Navy ships visits to the US.",Ministry of Defence,Ministry of Defence,Head Office and Corporate Services,0207 218 9507,HOCSFIN-HeadGroupMailbox@mod.uk,1062827,0.0,1.0,0,0,0,Military,,1
124,142227,N/D,SCS1,Operations Directorate - Head Afghanistan Pakistan Policy,Operational strategy and planning; direction and conduct of operations at the strategic level; maintenance of policy context for planning and conduct of operations. Afghanistan Policy Matters,Ministry of Defence,Ministry of Defence,Head Office and Corporate Services,0207 218 9507,HOCSFIN-HeadGroupMailbox@mod.uk,142008,0.0,1.0,0,0,0,Policy,,1
125,1055711,N/D,OF-6,Operations Directorate - Head Ops B,Operational strategy and planning; direction and conduct of operations at the strategic level; maintenance of policy context for planning and conduct of operations. Counter Terrorism Operations,Ministry of Defence,Ministry of Defence,Head Office and Corporate Services,0207 218 9507,HOCSFIN-HeadGroupMailbox@mod.uk,142008,0.0,1.0,0,0,0,Military,,1
126,143581,vacant,SCS1,Operations Directorate - Head Operational Policy (Civ),Operational strategy and planning; direction and conduct of operations at the strategic level; maintenance of policy context for planning and conduct of operations. Counter Terrorism Policy,Ministry of Defence,Ministry of Defence,Head Office and Corporate Services,,HOCSFIN-HeadGroupMailbox@mod.uk,142008,0.0,1.0,0,0,0,Policy,,1
127,184000,N/D,SCS1,Operations Directorate - Head Special Forces & Legal Policy,Operational strategy and planning; direction and conduct of operations at the strategic level; maintenance of policy context for planning and conduct of operations. Special Forces and Legal Issues ,Ministry of Defence,Ministry of Defence,Head Office and Corporate Services,0207 218 9507,HOCSFIN-HeadGroupMailbox@mod.uk,142008,0.0,1.0,0,0,0,Policy,,1
128,140333,N/D,SCS3,Director General Security Policy & Operations,MOD's principal adviser on defence contribution to HMG security policy and shaping international relations,Ministry of Defence,Ministry of Defence,Head Office and Corporate Services,0207 218 9507,HOCSFIN-HeadGroupMailbox@mod.uk,00109715,0.0,1.0,125000,129999,0,Policy,,1
129,141691,N/D,SCS2,Director International Security Policy,"Security co-operation activiity  - NATO/EU/UN, Europe and North Africa, North America, Russia, China, Koreas and Japan; Arms Control and Counter Proliferation, Conflict Pool Director       ",Ministry of Defence,Ministry of Defence,Head Office and Corporate Services,0207 218 9507,HOCSFIN-HeadGroupMailbox@mod.uk,140333,0.0,1.0,85000,89999,0,Policy,,1
130,188553,N/D,SCS2,Director Judicial Engagement Policy,"Policy on judicial and external scrutiny of MOD business, including Iraq and other public enquiries, inquests and significant claims against the department.     ",Ministry of Defence,Ministry of Defence,Head Office and Corporate Services,0207 218 9507,HOCSFIN-HeadGroupMailbox@mod.uk,140333,0.0,1.0,95000,99999,0,Policy,,1
131,142008,N/D,SCS2,Director Operational Policy,"CT & SF Policy; NI and GB issues; policy context for planning and conduct of operations; Iraq/Afghanistan/Iran/South America(inc Brazil, Argentina, Falklands, Chile); Stabilisation Unit Director",Ministry of Defence,Ministry of Defence,Head Office and Corporate Services,0207 218 9507,HOCSFIN-HeadGroupMailbox@mod.uk,1055683,0.0,1.0,80000,84999,0,Policy,,1
132,142662,N/D,SCS1,Head Arms Control & Proliferation,"Provide advice on all aspects of counter-proliferation, disarmament and arms control, both policy and implementation",Ministry of Defence,Ministry of Defence,Head Office and Corporate Services,0207 218 9507,HOCSFIN-HeadGroupMailbox@mod.uk,1055683,0.0,1.0,0,0,0,Policy,,1
133,1121412,N/D,OF-6,"Head Chemical, Biological, Radiological & Nuclear Policy",Policy lead for countering all aspects of the threat posed by CBRN weapons of mass destruction (WMD) ,Ministry of Defence,Ministry of Defence,Head Office and Corporate Services,0207 218 9507,HOCSFIN-HeadGroupMailbox@mod.uk,196733,0.0,1.0,0,0,0,Military,,1
134,1062827,Major General Buster Howes,OF-7,Head of British Defence Staff-United States and Defence Attaché.,"The DA is Her Majesty’s Ambassador’s senior adviser on defence issues, and as Head of the BDS-US has responsibility for all military and civilian MoD personnel located both within the Embassy and in 34 states across the USA. Responsibilities include sustaining collective oversight of the bilateral Defence relationship with the USA and all related MOD activity. Pursuing objectives and priorities endorsed by DG Sec Pol.",Ministry of Defence,Ministry of Defence,Head Office and Corporate Services,0207 218 9507,HOCSFIN-HeadGroupMailbox@mod.uk,140333,0.0,1.0,115000,119999,0,Military,,1
135,1055688,N/D,OF-6,DOC-Head,Produce Defence Operational Lessons and conduct Audit of Defence capability ,Ministry of Defence,Ministry of Defence,Head Office and Corporate Services,0207 218 9507,HOCSFIN-HeadGroupMailbox@mod.uk,00109715,0.0,1.0,0,0,0,Military,,1
136,135042,N/D,SCS1,Head International Policy France," International acquisition issues within MOD and wider Government & US, FR, the EU (EDA) and NATO; US/UK Defence Trade Treaty; UK-France Higher Level Working Group ",Ministry of Defence,Ministry of Defence,Head Office and Corporate Services,0207 218 9507,HOCSFIN-HeadGroupMailbox@mod.uk,141691,0.0,1.0,0,0,0,Policy,,1
137,142856,N/D,SCS1,Head International Policy & Planning(Civilian),"Delivery of global military strategic planning; development of  security co-operation, conflict prevention and security sector reform in the Levant, Sub-Saharan Africa, South and South East Asia; recruit, direct and support worldwide Defence Attaché and Loan Service network ",Ministry of Defence,Ministry of Defence,Head Office and Corporate Services,0207 218 9507,HOCSFIN-HeadGroupMailbox@mod.uk,141691,0.0,1.0,0,0,0,Policy,,1
138,1561030,N/D,OF-6,Head Military Strategic Planning,"Delivery of global military strategic planning; development of  security co-operation, conflict prevention and security sector reform in the Levant, Sub-Saharan Africa, South and South East Asia; recruit, direct and support worldwide Defence Attaché and Loan Service network ",Ministry of Defence,Ministry of Defence,Head Office and Corporate Services,0207 218 9507,HOCSFIN-HeadGroupMailbox@mod.uk,1716524,0.0,1.0,0,0,0,Military,,1
139,148649,N/D,SCS1,Head NATO & Europe Policy ,Policy advice directed at promoting the UK’s security interests through NATO and the EU and with European partners.,Ministry of Defence,Ministry of Defence,Head Office and Corporate Services,0207 218 9507,HOCSFIN-HeadGroupMailbox@mod.uk,141691,0.0,1.0,0,0,0,Policy,,1
140,142073,N/D,SCS1,Head Defence Security and Priorities,Lead on  the Ministry of Defence’s contribution to the development of the National Security Strategy (NSS) and Strategic Defence and Security Review (SDSR);,Ministry of Defence,Ministry of Defence,Head Office and Corporate Services,0207 218 9507,HOCSFIN-HeadGroupMailbox@mod.uk,141691,0.0,1.0,0,0,0,Policy,,1
141,194736,Lieutenant General Simon Mayall,OF-8,Special Representative to the Middle East,"Special Representative to the Middle East, on behalf of Secretary of State",Ministry of Defence,Ministry of Defence,Head Office and Corporate Services,0207 218 9507,HOCSFIN-HeadGroupMailbox@mod.uk,00155792,0.0,1.0,150000,154999,0,Military,,1
142,1716524,Rear Admiral Simon Ancona,OF-7,ACDS Military Strategy,ACDS (Mil Strat) leads military strategic planning to inform and implement HMG/Defence strategy and advise COS and ministers,Ministry of Defence,Ministry of Defence,Head Office and Corporate Services,0207 218 9507,HOCSFIN-HeadGroupMailbox@mod.uk,1055683,0.0,1.0,110000,114999,0,Military,,1
143,1586951,N/D,OF-6,Hd International Policy & Planning Military,"Delivery of global military strategic planning; development of  security co-operation, conflict prevention and security sector reform in the Levant, Sub-Saharan Africa, South and South East Asia; recruit, direct and support worldwide Defence Attaché and Loan Service network ",Ministry of Defence,Ministry of Defence,Head Office and Corporate Services,0207 218 9507,HOCSFIN-HeadGroupMailbox@mod.uk,141691,0.0,1.0,0,0,0,Military,,1
144,1056166,Lt Gen Andrew Gregory,OF-8,Chief Defence Personnel,"DCDS (Pers) is the Service personnel Process Owner who directs and coordinates Joint Service Personnel Strategy in order that sufficient Service personnel are recruited, trained, and retained to sustain the Armed Forces.  His principal role is to ensure that the right policies, strategies and legislation are in place to deliver sufficient, capable and motivated people both today and in the future, as well as ensuring that Defence obligations for past service are met.  He reports to the Vice Chief of the Defence Staff.  He attends the Defence Operating Board as required.  Drawing on the advice of the Principal Personnel Officers on the Service Personnel Board, he is responsible for advising the Defence Board and Defence Operating Board on joint Service personnel matters and for the formulation of joint Service personnel policy.  He is the Senior Responsible Owner for the Defence Technical Training Change Programme.",Ministry of Defence,Ministry of Defence,Head Office and Corporate Services,0207 218 9507,HOCSFIN-HeadGroupMailbox@mod.uk,00109715,0.0,1.0,125000,129999,0,Military,,1
145,1621728,R Adm Simon Williams,OF-7,Assistant Chief Defence Staff (Personnel) / Defence Services Secretary ,"One of two Service Personnel Operating Officers (SPOO). ACDS(Pers) also has the role of Defence Services Secretary (DS Sec). The Honours and Ceremonial Division supports ACDS(Pers) in both roles. The Division has a wide portfolio focused on policy for medals and commemorations; and Royal Household business. DS Sec is a member of the Royal Household. DS Sec also manages tri-Service appointments and Senior Officer remuneration in support of CDS. The DS Sec and the Royal Household Team, support the Queen as Head of the Armed Forces and ensures effective liaison between the Royal Household and the MOD. The team has responsibility for: military manpower support; submissions; petitions; Royal patronage; and the co-ordination of Royal Visits to the Armed Forces. The Ceremonial Events and Commemorations Team, develops and implements policies and events for national recognition of Armed Forces personnel, including being responsible for tri-Service policy for the national commemoration of anniversaries of significance to the Armed Forces and the MOD, and the delivery of these events. ",Ministry of Defence,Ministry of Defence,Head Office and Corporate Services,0207 218 9507,HOCSFIN-HeadGroupMailbox@mod.uk,1056166,0.0,1.0,0,0,0,Military,,1
146,1621333,N/D,OF-6,"Head Training Education Skills, Recruitment and Resettlement

 

","The TESRR Division is responsible for MoD recruitment policy, setting, managing and assuring the Defence Training and Education Strategy (DTES) and the policy for SP resettlement and the delivery of 3rd Line resettlement (through a Public/Private partnership). TESRR is responsible for cohering the Training DLoD in TLCM and for the setting of strategic framework for Defence Training, Simulation and Infrastructure.  TESRR works under ACDS(Pers&Trg) to facilitate the 3* Defence Training Board and enables subordinate governance and coordination arrangements.

",Ministry of Defence,Ministry of Defence,Head Office and Corporate Services,0207 218 9507,HOCSFIN-HeadGroupMailbox@mod.uk,1621728,0.0,1.0,0,0,0,Military,,1
147,175364,N/D,SCS1,Head Service & Veterans Welfare ,"Responsible for the development and promulgation of tri-Service policy for the Armed Forces on a range of non-financial terms and conditions of service plus accommodation, families and welfare issues.",Ministry of Defence,Ministry of Defence,Head Office and Corporate Services,0207 218 9507,HOCSFIN-HeadGroupMailbox@mod.uk,1621728,0.0,1.0,0,0,0,Policy,,1
148,106181,Gavin Barlow,SCS2,Director Service Personnel Policy,"As one of the two Service Personnel Operating Officers (SPOOs) Director Service Personnel Policy directs the work of the Service Personnel Staff on behalf of DCDS(Pers), and are  responsible for directing the execution of the work of the Service Personnel Staff.  This includes:Chairmanship of the Service Personnel Operating Board; day-to-day prioritisation in response to events; Line management of the Heads of the policy divisions;Facilitation of the policy formulation process, through frequent dialogue with the policy divisions and their counterparts in the Services’ personnel staffs; Assurance of the quality and timeliness of work carried out by the Service Personnel Staff.

",Ministry of Defence,Ministry of Defence,Head Office and Corporate Services,0207 218 9507,HOCSFIN-HeadGroupMailbox@mod.uk,1056166,0.0,1.0,85000,89999,0,Policy,,1
149,1622463,N/D,OF-6,Remuneration                                           ,"The Division is responsible for formulating, maintaining and developing pay, charges and allowances policy which is fair to the individual, to the Armed Forces and to the taxpayer and supports the delivery of operational capability.  The Division is also responsible for strategic manning policy and the Armed Forces Redundancy Schemes and for providing co-ordination and a policy framework for the current Armed Forces redundancy programme. ",Ministry of Defence,Ministry of Defence,Head Office and Corporate Services,0207 218 9507,HOCSFIN-HeadGroupMailbox@mod.uk,106181,0.0,1.0,0,0,0,Military,,1
150,169882,N/D,SCS1,Head Defence Personnel Secretariat ,"The Secretariat is responsible for Parliamentary business; policy matters relating to legislation, discipline, conduct and complaints within the Armed Forces; and equality and diversity issues for the whole MOD workforce.

 

",Ministry of Defence,Ministry of Defence,Head Office and Corporate Services,0207 218 9507,HOCSFIN-HeadGroupMailbox@mod.uk,106181,0.0,1.0,0,0,0,Policy,,1
151,1560696,N/D,OF-6,Head Strategy & Programme Management ,"The Strategy and Programme Division is split into two staff teams, responsible for Service Personnel strategy and NEM",Ministry of Defence,Ministry of Defence,Head Office and Corporate Services,0207 218 9507,HOCSFIN-HeadGroupMailbox@mod.uk,106181,0.0,1.0,0,0,0,Military,,1
152,110655,N/D,SCS1,Expert Medical Advice ,Provision of medical advice relating to Service Personnel Policy. ,Ministry of Defence,Ministry of Defence,Head Office and Corporate Services,0207 218 9507,HOCSFIN-HeadGroupMailbox@mod.uk,106181,0.0,1.0,0,0,0,Medicine,,1
153,1590218,John Crackett,OF-7,Assistant Chief Defence Staff Reserves & Cadets,"ACDS(R&C), the senior Reservist in Defence, reports to DCDS(Pers&Trg) and is responsible for developing policy for both the Reserve Forces and the Cadet Forces.  The role shapes the use of Reserve Forces in the near term as well as developing the strategic direction for reserves through interaction with a wide variety of stakeholders including the Secretary of State, Ministers and single Service Chiefs.  As one of the five 2* officers within DCDS(PERS and TRNG) ACDS (R&C) fulfils a key role in the wider management of Service personnel both Regular and Reserve.



",Ministry of Defence,Ministry of Defence,Head Office and Corporate Services,0207 218 9507,HOCSFIN-HeadGroupMailbox@mod.uk,1056166,0.0,1.0,110000,114999,0,Military,,1
154,1056713,N/D,OF-6,Head Reserve Forces & Cadets,"Head RF&C is responsible for the delivery of the Future Reserves 2020 programme on behalf of the SRO, DCDS(Pers&Trg).  The programme aims to reinvigorate the Reserve Forces and further integrate them as part of a Whole Force.. RF&C assures the optimal use of Reservists on operations through efficient and effective mobilisation and call out orders.  Additionally the role ensures that the Reserve Forces will continue to provide capability in the future through the FR20 programme.  Hd RF&C will also provide oversight of the implementation of the Defence Youth Engagement Review.  This requires considerable interaction with wider areas of government as well as with the single Services.



",Ministry of Defence,Ministry of Defence,Head Office and Corporate Services,0207 218 9507,HOCSFIN-HeadGroupMailbox@mod.uk,1590218,0.0,1.0,0,0,0,Military,,1
