155,179774,Bruce Houlder QC,SCS2,Director Service Prosecution Authority,"The Service Prosecuting Authority provides for the independent, efficient and consistent consideration of criminal cases and offences contrary to military discipline.  It will initiate prosecutions where justified and conduct fair and thorough proceedings in the service courts of first instance and the service appellate courts, whilst liaising effectively with the police and dealing with prosecution witnesses and victims of crime with care and sensitivity. Whilst maintaining independence from the service chain of command, the Service Prosecuting Authority fulfils its functions in support of operational effectiveness of the Armed Forces throughout the world.",Ministry of Defence,Ministry of Defence,Head Office and Corporate Services,0207 218 9507,HOCSFIN-HeadGroupMailbox@mod.uk,1056166,0.0,1.0,150000,154999,0,Law,,1
156,1166821,N/D,OF-6,Deputy Director Service Prosecutions ,"Support the provision of independent, efficient and consistent consideration of criminal cases and offences contrary to military discipline.
",Ministry of Defence,Ministry of Defence,Head Office and Corporate Services,0207 218 9507,HOCSFIN-HeadGroupMailbox@mod.uk,0179774,0.0,1.0,0,0,0,Military,,1
157,110709,AVM Ross Paterson,OF-7,Chief Executive Service Personnel & Veterans Agency,"SPVA provides harmonised personnel administration services and accurate payment of pay, allowances and pensions to the serving and Veterans communities.",Ministry of Defence,Ministry of Defence,Head Office and Corporate Services,0207 218 9507,HOCSFIN-HeadGroupMailbox@mod.uk,110709,0.0,1.0,110000,114999,0,Operational Delivery,,1
158,110713,N/D,OF-6,Head of Strategy & Programmes ,"The Strategy & Programmes (S & P) Directorate’s role is to assist the achievement of the Agency Aim through the effective identification, programming and delivery of new change requirements, in conjunction with EDS, in order to meet legislative, Service Policy and efficiency requirements. ",Ministry of Defence,Ministry of Defence,Head Office and Corporate Services,0207 218 9507,HOCSFIN-HeadGroupMailbox@mod.uk,110709,0.0,1.0,0,0,0,Military,,1
159,105357,N/D,SCS1,Head of Veteran's Services,"Veterans Services are responsible for the assessment, award, payment and maintenance of all pensions relating to service in the Armed Forces.  These include occupational pensions (The Armed Forces Pension Schemes (AFPS)), war disablement pensions, war widows’ pensions, related allowances and other payments to service veterans.  They also administer the ex-gratia payments scheme to former prisoners of the Japanese in World War 2. Additionally, Veterans Services undertake the assessment, award and maintenance of Armed Forces Compensation Scheme (AFCS) claims plus the presentation of appeals to independent Pensions Appeal Tribunals (PAT) for both current and former Service personnel. ",Ministry of Defence,Ministry of Defence,Head Office and Corporate Services,0207 218 9507,HOCSFIN-HeadGroupMailbox@mod.uk,110709,0.0,1.0,0,0,0,Operational Delivery,,1
160,110712,N/D,OF-6,Head of Military Services,"Responsible for military pay, allowances and expenses, the MOD Medal Office and the Joint Casualty and Compassionate Centre.  The Department provide military personnel support processes, enabled through JPA, the Veterans Compensation and Payments System and the War Pensions Computer System.  They provide the management and future development of IT and processes in support of serving military personnel, Reserves and Veterans in line with evolving policy.",Ministry of Defence,Ministry of Defence,Head Office and Corporate Services,0207 218 9507,HOCSFIN-HeadGroupMailbox@mod.uk,110709,0.0,1.0,0,0,0,Military,,1
161,194510,Dr Susan Atkins,SCS2,Service Complaints Commissioner (SCC)                                      (Fee Earner 2* equivalent),"The Commissioner provides an independent oversight of how the Service complaints system is working and reports back to Ministers and to Parliament. The Commissioner also provides an alternative point of contact for Service personnel, or someone acting on ",Ministry of Defence,Ministry of Defence,Head Office and Corporate Services,0207 218 9507,HOCSFIN-HeadGroupMailbox@mod.uk,175364,0.0,1.0,0,0,0,Other,,1
