46,106838,N/D,SCS1,HRD-Strategic HR-Head 2,"The Head Office Strategic HR Policy team is responsible for strategic workforce management, talent management, skills planning, and HR policies and procedures, which meet business needs, support managers to get the best from their people now and in the future, and enable the Department manage employee relations and comply with employment and equality legislation. ",Ministry of Defence,Ministry of Defence,Head Office and Corporate Services,0207 218 9507,HOCSFIN-HeadGroupMailbox@mod.uk,00195772,0.0,1.0,0,0,0,Human Resources,,1
47,191185,Air Marshal R Garwood,OF-8,Director General Military Aviation Authority,"The Director General of the Military Aviation Authority has full oversight of all Defence Aviation activity, and is the single regulatory authority responsible for regulating all aspects of Air Safety across Defence. He achieves this through establishing and maintaining an appropriate regulatory framework, given effect by a certification, approvals and inspection process extending across the acquisition, operation and continued airworthiness of air systems within the Defence aviation environment, and by independant surveillance of relevant Departmental planning and programming processes. The Director General provides assurance to the Secretary of State for Defence through the Second Permanent Under Secretary of State that high standards of Air Safety are maintained in the conduct of military aviation. He attends the Defence Environment and Safety Board, but, as an independant Regulator, is not formally accountable to it. The Director General is the Convening Authority for all Service Inquiries into military aircraft occurrences.",Ministry of Defence,Ministry of Defence,Head Office and Corporate Services,0207 218 9507,HOCSFIN-HeadGroupMailbox@mod.uk,00109715,0.0,1.0,145000,149999,0,Military,,1
48,191191,Air Vice Marshal Atherton,OF-7,Director Operations Military Aviation Authority,"Member of the MAA Executive Board.  Lead and direct the Operations Group of the MAA; overseeing coherent regulation and safe conduct of all military flying operations and acting as operating regulatory lead with FLCs, DE&S and Industry; link to OGDs and Agencies outside Government on aviation operating matters, including international liaison. In addition he is charged with continuously improving and transforming the organisation to fully meet the role of independent regulator.",Ministry of Defence,Ministry of Defence,Head Office and Corporate Services,0207 218 9507,HOCSFIN-HeadGroupMailbox@mod.uk,191185,0.0,1.0,110000,114999,0,Military,,1
49,185281,Air Vice Marshal Clark,OF-7,Director Technical Military Aviation Authority,"Member of the MAA Executive Board.  Lead and direct the Technical Group of the MAA; technical regulatory lead with FLCs, DE&S and Industry; link to OGDs and Agencies outside Government on aviation operating matters, including international liaison.",Ministry of Defence,Ministry of Defence,Head Office and Corporate Services,0207 218 9507,HOCSFIN-HeadGroupMailbox@mod.uk,191185,0.0,1.0,110000,114999,0,Military,,1
50,191217,N/D,OF-6,Head Oversight & Approvals Military Aviation Authority,"MAA Oversight and Approvals regulates, on behalf of DG MAA, the operation of all aircraft registered as UK Military Aircraft (manned and unmanned) covering all aerial activities of FLCs, DE&S and contractors’. MAA O&A regulation activities also extend to Military Registered Civil-Owned Aircraft (MRCOA).  In addition, a key output is the contribution to assurance of the airworthiness of aviation on the UKMR through airworthiness organisation and key individual approvals.",Ministry of Defence,Ministry of Defence,Head Office and Corporate Services,0207 218 9507,HOCSFIN-HeadGroupMailbox@mod.uk,185281,0.0,1.0,0,0,0,Military,,1
51,164078,N/D,SCS1,Head Analysis & Plans Military Aviation Authority,"The maintenance and promulgation of the MoD’s through-life Airworthiness Regulations, Standards and associated publications.  Regulation and Policy publication coherence.  Take the lead for the harmonization of airworthiness across European military authorities.  Develop the MAA approach to Risk Management.  Responsible for the end-to-end output of AUP considering the full spectrum of the Military Air Environment.  Exploit Air Safety knowledge assessing performance and risk to develop an evidence based prioritized plan pan MAA.",Ministry of Defence,Ministry of Defence,Head Office and Corporate Services,0207 218 9507,HOCSFIN-HeadGroupMailbox@mod.uk,191191,0.0,1.0,0,0,0,Programme and Project Management (PPM),,1
52,191196,N/D,OF-6,Head Certification & Regulation Military Aviation Authority,"Regulation.  The development, maintenance and promulgation of the MOD’s through-life Flying, ATM, Design and Continuing Airworthiness Regulations, Standards and associated publications; includng translation of MAA policy into the regulatory framework, regulatory review and risk assessment, and consideration of regulatory change, alternative AMC, waiver and sanction activity. Certification.  The Certification of all new UK military registered air systems and major changes to type designs, assurance of aircraft structural, propulsion and systems integrity management, the sponsorship, management and maintenance of UK aircraft design and airworthiness standards, and asurance of the safety of ships' aviation facilities.  In addition, providing SME input to the development and maintenance of regulation covering all the areas of Certification business.  ",Ministry of Defence,Ministry of Defence,Head Office and Corporate Services,0207 218 9507,HOCSFIN-HeadGroupMailbox@mod.uk,185281,0.0,1.0,0,0,0,Military,,1
53,100916,Alfred Hitchcock,SCS2,Chief Constable MoD Police & Guarding Agency,The MDP Chief Constable is responsible for the delivery of effective Policing and Guarding in support of the UK's Defence capability. The focus of all MDPGA activity is to counter the main crime and security risks faced by the MOD: Terrorist attack and the threat of attack: disruption and disorder caused by protestors; theft of key assets; major financial fraud; and unauthorised intrusion onto the Defence Estate,Ministry of Defence,Ministry of Defence,Head Office and Corporate Services,0207 218 9507,HOCSFIN-HeadGroupMailbox@mod.uk,00179598,0.0,1.0,150000,154999,0,Other,,1
54,100919,N/D,SCS1,Deputy Chief Constable MDPGA,"The Deputy Chief Constable MDP is responsible for the delivery of operational civilian policing services to MOD establishments in the UK, both military and civilian, inclusive of armed guarding and support to national critical infrastructure, contributing to international policing in countries such as Afghanistan where the MDP help develop and deliver human rights-based local policing, training and mentoring local recruits",Ministry of Defence,Ministry of Defence,Head Office and Corporate Services,0207 218 9507,HOCSFIN-HeadGroupMailbox@mod.uk,00100916,0.0,1.0,0,0,0,Other,,1
55,113908,N/D,SCS1,Head of Corporate Services MDPGA,"The Head of Corporate Services MDPGA is responsible for providing Financial, Secretarial, Parliamentary and other Corporate Service support and advice to the Chief Constable of the MDPGA and other senior colleagues",Ministry of Defence,Ministry of Defence,Head Office and Corporate Services,0207 218 9507,HOCSFIN-HeadGroupMailbox@mod.uk,00100916,0.0,1.0,0,0,0,Policy,,1
56,202795,N/D,SCS1,Head of MDP TACOS Review ,Head of MDP TACOS Review,Ministry of Defence,Ministry of Defence,Head Office and Corporate Services,0207 218 9507,HOCSFIN-HeadGroupMailbox@mod.uk,00100916,0.0,1.0,0,0,0,Policy,,1
57,1047423,Air Marshal Stephen Hillier,OF-8,Deputy Chief of Defence Staff (Military Capability),"DCDS(Mil Cap) acts as an identifiable, responsible and strong Capability Sponsor across the MOD Unified Customer in order to deliver capability that meets the endorsed requirements. Priority is given to current operations (particularly Afghanistan) exploiting both Equipment Plan and Urgent Operational Requirement processes. DCDS(Mil Cap)s other key objective is to generate and implement an affordable, balanced and coherent Equipment and Equipment Support Plan which is realistic and has agility. DCDS(Mil Cap) chairs the Military Capabilities Board (MCB).",Ministry of Defence,Ministry of Defence,Head Office and Corporate Services,0207 218 9507,HOCSFIN-HeadGroupMailbox@mod.uk,00109715,0.0,1.0,135000,139999,0,Military,,1
58,1431838,Eliminated,OF-7,Director Land Capability and Transformation,D LC&T is a member of the MCB leading on the Fin Mil Cap Transformation (FMCT) programme.  D LC&T is amember of the Army Board as the Master General of Ordnance.,Ministry of Defence,Ministry of Defence,Head Office and Corporate Services,,HOCSFIN-HeadGroupMailbox@mod.uk,1047423,0.0,1.0,0,0,0,Military,,1
59,1105905,Rear Admiral Henry Parker,OF-7,Director Carrier Strike,D Carrier Strike (D CS) is a member of the MCB and the Senior Responsible Owner (SRO) for Carrier Strike (CS). D CS is amember of the Navy Board as the Controller of the Navy.,Ministry of Defence,Ministry of Defence,Head Office and Corporate Services,0207 218 9507,HOCSFIN-HeadGroupMailbox@mod.uk,1047423,0.0,1.0,110000,114999,0,Military,,1
60,1055224,Major General Mark Poffley,OF-7,Assistant Chief of Defence Staff (Capability & Force Development),"ACDS(C&FD) is a member of the MCB leading on coherence across all the Defence Lines of Development, force structure and performance management ",Ministry of Defence,Ministry of Defence,Head Office and Corporate Services,0207 218 9507,HOCSFIN-HeadGroupMailbox@mod.uk,1047423,0.0,1.0,120000,124999,0,Finance,,1
61,137390,Ian Forber,SCS2,Director Strategic Programmes,"D Strat Prog is a member of the MCB and SRO for the Nuclear Capability. He is also responsible to the MCB for the management and coorination of Complex Weapons, Test & Evaluation and capability assurance and protection.",Ministry of Defence,Ministry of Defence,Head Office and Corporate Services,0207 218 9507,HOCSFIN-HeadGroupMailbox@mod.uk,1047423,0.0,1.0,80000,84999,0,Programme and Project Management (PPM),,1
62,1564419,N/D,OF-6,Head of Carrier Strike,Responsible for the management of the Carrier Strike programme office and Defence-wide capability solutions related to the Carrier Strike programme.,Ministry of Defence,Ministry of Defence,Head Office and Corporate Services,0207 218 9507,HOCSFIN-HeadGroupMailbox@mod.uk,1105905,0.0,1.0,0,0,0,Military,,1
63,137389,N/D,SCS1,"Head of Weapons, Evauation & Capability Assurance","Responsible for the delivery of Defence-wide capability solutions to the MCB related to facilities to test, evaluate and develop cost-effective military capability. Also responsible for capability planning and coherence of the Complex Weapons portfolio, capability assurance and protection.",Ministry of Defence,Ministry of Defence,Head Office and Corporate Services,0207 218 9507,HOCSFIN-HeadGroupMailbox@mod.uk,00137390,0.0,1.0,0,0,0,Programme and Project Management (PPM),,1
64,174902,N/D,OF-6,Head of Nuclear Capability,"Responsible for the delivery of a UK operationally independent, continuous and invulnerable strategic nuclear deterrent; providing support to the Senior Responsible Officer for the deterrent and ensure's that the many projects in the deterrent area are managed as a coherent programme.",Ministry of Defence,Ministry of Defence,Head Office and Corporate Services,0207 218 9507,HOCSFIN-HeadGroupMailbox@mod.uk,00137390,0.0,1.0,0,0,0,Military,,1
65,1047497,N/D,OF-6,Head of Fin Mil Cap Joint,Resource planning and capability coherence for Joint Forces Command and Head Office,Ministry of Defence,Ministry of Defence,Head Office and Corporate Services,0207 218 9507,HOCSFIN-HeadGroupMailbox@mod.uk,1055224,0.0,1.0,0,0,0,Military,,1
66,126796,N/D,OF-6,Head of Fil Mil Cap Army,Resource planning and capability coherence for Army,Ministry of Defence,Ministry of Defence,Head Office and Corporate Services,0207 218 9507,HOCSFIN-HeadGroupMailbox@mod.uk,1055224,0.0,1.0,0,0,0,Military,,1
67,1055232,N/D,OF-6,Head of Fin Mil Cap Air,Resource planning and capability coherence for Air,Ministry of Defence,Ministry of Defence,Head Office and Corporate Services,0207 218 9507,HOCSFIN-HeadGroupMailbox@mod.uk,1055224,0.0,1.0,0,0,0,Military,,1
68,1055721,N/D,OF-6,Head of Fin Mil Cap Strategy Management,"Responsible for overall capability coherence, force structure and performance management",Ministry of Defence,Ministry of Defence,Head Office and Corporate Services,0207 218 9507,HOCSFIN-HeadGroupMailbox@mod.uk,1055224,0.0,1.0,0,0,0,Military,,1
69,1106793,N/D,OF-6,Head of Fin Mil Cap Navy,Resource planning and capability coherence for Navy,Ministry of Defence,Ministry of Defence,Head Office and Corporate Services,0207 218 9507,HOCSFIN-HeadGroupMailbox@mod.uk,1055224,0.0,1.0,0,0,0,Military,,1
70,163901,"Mason,Susanna Margaret",SCS3,DG Exports,"Management of commercial strategy for emerging exports working closely with UKTI DSO, DES Project Teams and Air Command to deliver benefits to MOD and VFM for our customers. SRO for Lord Currie's Independent review of Single Source Pricing Regulations. Renegotiation of contracts impacted by the Strategic Defence and Security Review.",Ministry of Defence,Ministry of Defence,Head Office and Corporate Services,0207 218 9507,HOCSFIN-HeadGroupMailbox@mod.uk,00005654,0.0,1.0,165000,169999,0,Policy,,1
71,172696,N/D,SCS1,Defence Exports & Commercial Strategy - Head of Exports (Projects) ,Provide management and set strategic direction for the requirement ensuring coherence across the UAE programme.,Ministry of Defence,Ministry of Defence,Head Office and Corporate Services,0207 218 9507,HOCSFIN-HeadGroupMailbox@mod.uk,00163901,0.0,1.0,0,0,0,Programme and Project Management (PPM),,1
72,194481,N/D,SCS1,Defence Exports & Commercial Strategy - Head,Set strategic direction for the commercial team and maintain overarching strategies for the nucleus of the commercial team.,Ministry of Defence,Ministry of Defence,Head Office and Corporate Services,0207 218 9507,HOCSFIN-HeadGroupMailbox@mod.uk,00163901,0.0,1.0,0,0,0,Policy,,1
73,1740527,"Green, Mark",OF-7,Director Strategic Projects,"Provide capability management, programme management and strategic military input to the UAE Strategic Partnership. Delivery of Typhoon GFX including a UAE Force Development Package and  Electronic Warfare MOU, Medium Altitude Long Endurance Remotely Piloted Air system Programme and Missile technology Control Regime MOU.  ",Ministry of Defence,Ministry of Defence,Head Office and Corporate Services,0207 218 9507,HOCSFIN-HeadGroupMailbox@mod.uk,00163901,0.0,1.0,115000,119999,0,Programme and Project Management (PPM),,1
74,178,N/D,SCS1,DES IRG-Hd,UAE DE&S,Ministry of Defence,Ministry of Defence,Head Office and Corporate Services,0207 218 9507,HOCSFIN-HeadGroupMailbox@mod.uk,00163901,0.0,1.0,0,0,0,Policy,Being Paid by DE&S. On HO&CS return for reporting purposes ony ,1
75,172696,N/D,SCS1,DECS-ExportProj-Hd ,UAE DE&S,Ministry of Defence,Ministry of Defence,Head Office and Corporate Services,0207 218 9507,HOCSFIN-HeadGroupMailbox@mod.uk,00163901,0.0,1.0,0,0,0,Procurement,Being Paid by DE&S. On HO&CS return for reporting purposes ony ,1
76,176079,"Payne, Nicholas",SCS2,DECS-D,UAE DE&S,Ministry of Defence,Ministry of Defence,Head Office and Corporate Services,0207 218 9507,HOCSFIN-HeadGroupMailbox@mod.uk,00163901,0.0,1.0,115000,119999,0,Procurement,Being Paid by DE&S. On HO&CS return for reporting purposes ony ,1
77,192984,N/D,SCS1,DECS UAE Support International Commercial,UAE DE&S,Ministry of Defence,Ministry of Defence,Head Office and Corporate Services,0207 218 9507,HOCSFIN-HeadGroupMailbox@mod.uk,00163901,0.0,1.0,0,0,0,Procurement,Being Paid by DE&S. On HO&CS return for reporting purposes ony ,1
78,194481,N/D,SCS1,DECS Hd,UAE DE&S,Ministry of Defence,Ministry of Defence,Head Office and Corporate Services,0207 218 9507,HOCSFIN-HeadGroupMailbox@mod.uk,00163901,0.0,1.0,0,0,0,Procurement,Being Paid by DE&S. On HO&CS return for reporting purposes ony ,1
79,153528,N/D,SCS1,DECS-IP Hd,UAE DE&S,Ministry of Defence,Ministry of Defence,Head Office and Corporate Services,0207 218 9507,HOCSFIN-HeadGroupMailbox@mod.uk,00176079,0.0,1.0,0,0,0,Procurement,Being Paid by DE&S. On HO&CS return for reporting purposes ony ,1
80,154898,N/D,SCS1,DECS-CG Hd,UAE DE&S,Ministry of Defence,Ministry of Defence,Head Office and Corporate Services,0207 218 9507,HOCSFIN-HeadGroupMailbox@mod.uk,00176079,0.0,1.0,0,0,0,Procurement,Being Paid by DE&S. On HO&CS return for reporting purposes ony ,1
81,189656,N/D,SCS1,CSTT-Hd,Head of CSTT is responsible for Corporate Services Transformation,Ministry of Defence,Ministry of Defence,Head Office and Corporate Services,0207 218 9507,HOCSFIN-HeadGroupMailbox@mod.uk,00111789,0.0,1.0,0,0,0,Policy,,1
82,106000,David Williams,SCS3,Director General Finance,"Financial & performance management; planning round and in year management, government wide head of profession for accountants",Ministry of Defence,Ministry of Defence,Head Office and Corporate Services,0207 218 9507,HOCSFIN-HeadGroupMailbox@mod.uk,00005654,0.0,1.0,130000,134999,0,Finance,,1
83,106029,Carole Tolley,SCS2,Director of Resources Head Office and Corporate Finance ,"Director of Resources Head Office and Corporate Finance responsible for the Financial Management Policy and Accounting team and the Business Strategy and Governance team. As SFO for the HO&CS TLB, Dir Res HO&CF supports DG T&CS, the HO&CS TLB holder, in the day to day management of the TLB and as Head of Establishment for London Buildings. 

",Ministry of Defence,Ministry of Defence,Head Office and Corporate Services,0207 218 9507,HOCSFIN-HeadGroupMailbox@mod.uk,00106000,0.0,1.0,85000,89999,0,Finance,,1
84,111813,N/D,SCS1,"Business Strategy And Governance, Corporate Finance Defence Supply Group","Setting direction for trading funds, management of loans and dividens, advice to ministers as TF owners, asset management",Ministry of Defence,Ministry of Defence,Head Office and Corporate Services,0207 218 9507,HOCSFIN-HeadGroupMailbox@mod.uk,00106029,0.0,1.0,0,0,0,Policy,,1
85,199856,N/D,SCS1,"Business Strategy And Governance, Corporate Finance Defence Supply Group","Setting direction for trading funds, management of loans and dividens, advice to ministers as TF owners, asset management",Ministry of Defence,Ministry of Defence,Head Office and Corporate Services,0207 218 9507,HOCSFIN-HeadGroupMailbox@mod.uk,00106029,0.0,1.0,0,0,0,Policy,,1
86,202537,N/D,SCS1,"Business Strategy And Governance, Corporate Finance Defence Supply Group","Setting direction for trading funds, management of loans and dividens, advice to ministers as TF owners, asset management",Ministry of Defence,Ministry of Defence,Head Office and Corporate Services,0207 218 9507,HOCSFIN-HeadGroupMailbox@mod.uk,00106029,0.0,0.5,0,0,0,Policy,,1
87,25463,N/D,SCS1,"HD of Financial Management, Policy and Accounting","Development & operation of the defence financial management systems; policy relating to finance skills and finance issues including: regularity and propriety, income generation, external assistance, accounting, tax and duty, production of the MOD financia",Ministry of Defence,Ministry of Defence,Head Office and Corporate Services,0207 218 9507,HOCSFIN-HeadGroupMailbox@mod.uk,00106029,0.0,1.0,0,0,0,Finance,,1
88,106032,N/D,SCS1,HD Head Office and Corporate Services Finance,"Head of Finance for Head Office & Corperate Services TLB. Responsible for Planning, In Year Management, and all Aspects of financial management for the TLB.",Ministry of Defence,Ministry of Defence,Head Office and Corporate Services,0207 218 9507,HOCSFIN-HeadGroupMailbox@mod.uk,00106029,0.0,1.0,0,0,0,Finance,,1
89,110351,N/D,SCS1,"HD Head Office and Corporate Services Security, Safety and Business Resilience","Security, Safety & Business Continuity",Ministry of Defence,Ministry of Defence,Head Office and Corporate Services,0207 218 9507,HOCSFIN-HeadGroupMailbox@mod.uk,00106029,0.0,1.0,0,0,0,Policy,,1
90,198879,Vacant,SCS1,Hd of Counter Fraud and Loss,Countering fraud and loss in Defence,Ministry of Defence,Ministry of Defence,Head Office and Corporate Services,,HOCSFIN-HeadGroupMailbox@mod.uk,00106029,0.0,1.0,0,0,0,Policy,,1
91,105232,Richard Jones,SCS2,Director Financial Planning and Scrutiny ,Scrutiny and advice across the whole range of MOD systems,Ministry of Defence,Ministry of Defence,Head Office and Corporate Services,0207 218 9507,HOCSFIN-HeadGroupMailbox@mod.uk,00106000,0.0,1.0,80000,84999,0,Finance,,1
92,135903,N/D,SCS1,HD of Equipment Capability Secretariat,"Secretariat, requirement and affordability scrutiny, IAB approvals process",Ministry of Defence,Ministry of Defence,Head Office and Corporate Services,0207 218 9507,HOCSFIN-HeadGroupMailbox@mod.uk,00105232,0.0,1.0,0,0,0,Finance,,1
93,109679,N/D,SCS1,HD of Scrutiny Air/Sea/CIS,"Scrutiny & advice across a range of Air, maritime and communication & information systems projects",Ministry of Defence,Ministry of Defence,Head Office and Corporate Services,0207 218 9507,HOCSFIN-HeadGroupMailbox@mod.uk,00105232,0.0,1.0,0,0,0,Finance,,1
94,109782,N/D,SCS1,HD of Scrutiny Land/Estates/Policy,"Scrutiny and advice across policy & plans, land and defence estates projects",Ministry of Defence,Ministry of Defence,Head Office and Corporate Services,0207 218 9507,HOCSFIN-HeadGroupMailbox@mod.uk,00105232,0.0,1.0,0,0,0,Finance,,1
95,106044,N/D,SCS1,HD of Defence Resources,Planning rounds and in year management,Ministry of Defence,Ministry of Defence,Head Office and Corporate Services,0207 218 9507,HOCSFIN-HeadGroupMailbox@mod.uk,00105232,0.0,1.0,0,0,0,Finance,,1
96,107429,N/D,SCS1,HD of Defence Economics,"Economic advice, appraisal and evaluation",Ministry of Defence,Ministry of Defence,Head Office and Corporate Services,0207 218 9507,HOCSFIN-HeadGroupMailbox@mod.uk,00106039,0.0,1.0,0,0,0,Economics,,1
97,107421,N/D,SCS1,HD of Defence Statistics,"Personnel statistics,analysis, modelling, health, welfare and forecast of armed forces and MOD civilian personnel",Ministry of Defence,Ministry of Defence,Head Office and Corporate Services,0207 218 9507,HOCSFIN-HeadGroupMailbox@mod.uk,00106039,0.0,1.0,0,0,0,Statisticians,,1
98,195020,Eliminated,SCS2,Director of Financial Management Reform ,Responsible for Financial Management Reform,Ministry of Defence,Ministry of Defence,Head Office and Corporate Services,,HOCSFIN-HeadGroupMailbox@mod.uk,00106000,0.0,1.0,0,0,0,Finance,,1
99,198327,Eliminated,SCS1,HD Civil Service Reform (NE),Project work in support of Civil Service Reform in the North East,Ministry of Defence,Ministry of Defence,Head Office and Corporate Services,,HOCSFIN-HeadGroupMailbox@mod.uk,00195020,0.0,1.0,0,0,0,Finance,,1
100,106027,N/D,SCS1,HD of Internal Audit,Independent audit and counter fraud service,Ministry of Defence,Ministry of Defence,Head Office and Corporate Services,0207 218 9507,HOCSFIN-HeadGroupMailbox@mod.uk,00106000,0.0,1.0,0,0,0,Internal Audit,,1
101,106039,Roger Hutton,SCS2,Director Defence Strategy,"Director Strategy leads and manages three Deputy Directors and their teams, as well as maintaining and developing the Department’s strategic planning framework (centred on Defence Strategic Direction) and acting as the Department’s Digital Leader.",Ministry of Defence,Ministry of Defence,Head Office and Corporate Services,0207 218 9507,HOCSFIN-HeadGroupMailbox@mod.uk,00106000,0.0,1.0,80000,84999,0,Programme and Project Management (PPM),,1
102,106043,N/D,SCS1,HD of Corporate Strategy and Governance,Head of the Defence Transformation Unit leads on developing corporate strategy – through ownership of the overarching Strategy for Defence and implementation of the supporting planning architecture; managing the Defence Transformation Portfolio – overseeing the groupings of programmes and other initiatives that contribute to Transforming Defence; and advising on the corporate implications of key change proposals.,Ministry of Defence,Ministry of Defence,Head Office and Corporate Services,0207 218 9507,HOCSFIN-HeadGroupMailbox@mod.uk,00106039,0.0,1.0,0,0,0,Programme and Project Management (PPM),,1
103,311500,Vacant,SCS1,HD of Defence Reform Unit (Design),"Head of the Defence Reform Unit and, as Programme Director, is responsible to DG T&CS for the coherent delivery of the 53 Levene Recommendations under the Defence Reform Programme.  Also responsible for keeping alive the spirit of Defence Reform in the wider Department through his role as the Defence Operating Model Design Authority.",Ministry of Defence,Ministry of Defence,Head Office and Corporate Services,,HOCSFIN-HeadGroupMailbox@mod.uk,00106039,0.0,1.0,0,0,0,Programme and Project Management (PPM),,1
104,111565,N/D,SCS1,HD of Defence Reform Unit and Behaviours and Business Improvement,"Head of the Defence Reform Unit and, as Programme Director, is responsible to DG T&CS for the coherent delivery of the 53 Levene Recommendations under the Defence Reform Programme.  Also responsible for keeping alive the spirit of Defence Reform in the wider Department through his role as the Defence Operating Model Design Authority.",Ministry of Defence,Ministry of Defence,Head Office and Corporate Services,0207 218 9507,HOCSFIN-HeadGroupMailbox@mod.uk,00106039,0.0,1.0,0,0,0,Programme and Project Management (PPM),,1
105,195114,Eliminated,SCS1,HD of Defence Reform Unit (Behaviours and Business Improvement),"Head of Transformation Behaviours and Business Process Improvement team, including business process policy, GEMS scheme and Head Office Change Team.",Ministry of Defence,Ministry of Defence,Head Office and Corporate Services,,HOCSFIN-HeadGroupMailbox@mod.uk,00106039,0.0,1.0,0,0,0,Programme and Project Management (PPM),,1
