,Post Unique Reference,Name,Grade,Job Title,Job/Team Function,Parent Department,Organisation,Unit,Contact Phone,Contact E-mail,Reports to Senior Post,Salary Cost of Reports (£),FTE,Actual Pay Floor (£),Actual Pay Ceiling (£),,Professional/Occupational Group,Notes,Valid?
0,1001,Neil MacGregor,SCS4,Director,"To provide overall leadership and direction for the British Museum and to ensure it preserves and manages its collections, continues to develop its scholarly reputation, facilitates access for a wide range of audiences and works to the highest levels of governance and efficiency.","Department for Culture, Media and Sport",British Museum,Directorate,020 7323 8299,information@britishmuseum.org,XX,0.0,1.0,180000,184999,184580,,,1
1,4183,Joanna Mackle,SCS3,Deputy Director: Public Engagement,"Directing the Museums departments of communications, exhibitions, learning and audiences, international engagement and marketing to ensure co-ordination and coherence of all activities with which the public engage.","Department for Culture, Media and Sport",British Museum,Public Engagement,020 7323 8299,information@britishmuseum.org,1001,4194518.0,1.0,110000,114999,0,,,1
2,4184,Christopher Yates,SCS3,Deputy Director: Administration,"To ensure the Museum’s finances are sound and sustainable. To provide strategic financial and human resource advice and support to the Directorate, including taking the lead on potential efficiencies or increases in income across the Museum. To manage the business of the Museum through effective provision of strategic planning, to enable prompt and appropriate decision making.","Department for Culture, Media and Sport",British Museum,Income Generation and Administration,020 7323 8299,information@britishmuseum.org,1001,4171014.0,1.0,125000,129999,0,,,1
3,3444,Vacancy,SCS2,Director of Operations and Projects,To have overall responsibility for major projects and for maintaining the Museum's estate and buildings within budget allocations while overseeing long term improvements in the building and resource management. To have responsibility for Security and Visitor Operations and the safe and secure operation of the site both when open and closed to the public. ,"Department for Culture, Media and Sport",British Museum,Operations and Projects,020 7323 8299,information@britishmuseum.org,1001,7085801.0,1.0,0,0,0,,This role has been filled through an agency since April 2013.,1
4,4185,Jonathan Williams,SCS2,Deputy Director: Collections,"To be responsible for the care, development and deployment of the collection in the Museum, UK and abroad, and to lead the Keepers in respect of those responsibilities. To inspire and motivate the curatorial departments to achieve and maintain consistently high levels of intellectual excellence, both to the academic community and more general public.","Department for Culture, Media and Sport",British Museum,Collections,020 7323 8299,information@britishmuseum.org,1001,10972546.0,1.0,100000,104999,0,,,1
