109,184584,N/D,SCS1,DES COMRCL COS-Hd,"The MOD Commercial Chief of Staff ensures commercial practitioners across Defence have the guidance, tools and advice that they need to carry out their work effectively, efficiently and in accordance with best practice. ",Ministry of Defence,Ministry of Defence,Defence Equipment and Support,030 679 30206,DESSec-ParliamentaryBusiness@mod.uk,00170772,0.0,1.0,0,0,0,Procurement,,1.0
110,184599,N/D,SCS1,DES ISTAR-PDG3-HD,"The ISTAR programme delivery group 3 is responsible for Air Command and Control systems, including Air Defence systems.  ",Ministry of Defence,Ministry of Defence,Defence Equipment and Support,030 679 30206,DESSec-ParliamentaryBusiness@mod.uk,00003594,0.0,1.0,0,0,0,Programme and Project Management (PPM),,1.0
111,184652,"Beverstock, Mark RAdm",OF-7,DES SM CSSE-Dir,Responsible for assisting Chief Strategic Systems Executive in his role in providing assurance to the First Sea Lord for the delivery of Continuous At Sea Deterrence.  Also responsible for the Submarine Training and Education Programme.,Ministry of Defence,Ministry of Defence,Defence Equipment and Support,030 679 30206,DESSec-ParliamentaryBusiness@mod.uk,00170311,0.0,1.0,110000,114999,0,Military,,1.0
112,185268,N/D,SCS1,DES AS-AES-Hd,"Responsible for the provision of commodities (spares not procured by the relevant platform team) for all aircraft, including helicopters; the procurement and support of airfield ground vehicles and equipment; and for the procurement and support of aircraft defensive and targeting aids. Also responsible for the delivery and support of flight simulators and synthetic trainers for the majority of air platforms (including helicopters).  ",Ministry of Defence,Ministry of Defence,Defence Equipment and Support,030 679 30206,DESSec-ParliamentaryBusiness@mod.uk,00170429,0.0,1.0,0,0,0,Programme and Project Management (PPM),,1.0
113,188627,N/D,SCS1,DES CIO HEAD,The Chief Information Officer team is responsible for the information governance and information management processes within DE&S. ,Ministry of Defence,Ministry of Defence,Defence Equipment and Support,030 679 30206,DESSec-ParliamentaryBusiness@mod.uk,00000001,0.0,0.71,0,0,0,Knowledge and Information Management (KIM),,1.0
114,188813,N/D,OF-6,Head of Helicopters 3,"The Helicopters delivery team 3 is responsible for the continuing support and upgrading of the Apache and Chinook helicopters, as well as for all helicopter engines.  ",Ministry of Defence,Ministry of Defence,Defence Equipment and Support,030 679 30206,DESSec-ParliamentaryBusiness@mod.uk,00003179,0.0,1.0,0,0,0,Military,,1.0
115,188950,N/D,SCS1,DES SM-SEPP-Hd ,"Head of the Submarine Enterprise Performance Programme, a joint MOD/Industry business transformation initiative, the purpose of which is to enable the three key submarine suppliers within the submarine enterprise to work together collaboratively with the MOD to transform the way the enterprise is delivered and managed.  ",Ministry of Defence,Ministry of Defence,Defence Equipment and Support,030 679 30206,DESSec-ParliamentaryBusiness@mod.uk,00006158,0.0,1.0,0,0,0,Programme and Project Management (PPM),,1.0
116,190286,N/D,SCS1,DES Ships MCS-Hd,Responsible for the delivery and support of surface ship combat systems and provision and support of equipment fitted to surface ships and submarines. Naval Design Partnership lead. Provision of Combat Systems subject matter expertise and processes,Ministry of Defence,Ministry of Defence,Defence Equipment and Support,030 679 30206,DESSec-ParliamentaryBusiness@mod.uk,00000066,0.0,1.0,0,0,0,Programme and Project Management (PPM),,1.0
117,190517,N/D,OF-6,DES ISS SANGCOM-Comd-PD,"The UK supports the Saudi Arabian National Guard (SANG) by providing advice and assistance in the procurement, operation and maintenance of SANG communications and computer systems.  These projects are managed by the MOD, specifically by the DE&S (Director ISS) SANGCOM team, which is based mainly in the Kingdom of Saudi Arabia",Ministry of Defence,Ministry of Defence,Defence Equipment and Support,030 679 30206,DESSec-ParliamentaryBusiness@mod.uk,00033009,0.0,1.0,0,0,0,Military,,1.0
118,192717,N/D,SCS1,DES ISS Fin-Hd,"Professional head of Finance within the Information Systems and Services Operating Centre, responsible for financial planning, in year management, financial accounting and financial assurance and approvals",Ministry of Defence,Ministry of Defence,Defence Equipment and Support,030 679 30206,DESSec-ParliamentaryBusiness@mod.uk,00033009,0.0,1.0,0,0,0,Finance,,1.0
119,192726,N/D,SCS1,DES SM Fin-Hd,"Professional head of finance within the Submarine Operating Centre, responsible for financial planning, in year management, financial accounting and financial assurance and approvals",Ministry of Defence,Ministry of Defence,Defence Equipment and Support,030 679 30206,DESSec-ParliamentaryBusiness@mod.uk,00006158,0.0,1.0,0,0,0,Finance,,1.0
120,192782,N/D,SCS1,DES CA ST-FinHd,"Professional head of finance within the Combat Air Operating Centre, responsible for financial planning, in year management, financial accounting and financial assurance and approvals",Ministry of Defence,Ministry of Defence,Defence Equipment and Support,030 679 30206,DESSec-ParliamentaryBusiness@mod.uk,00051335,0.0,1.0,0,0,0,Finance,,1.0
121,192984,N/D,SCS1,DECS UAE Support International Commercial,DECS UAE Support International Commercial,Ministry of Defence,Ministry of Defence,Defence Equipment and Support,030 679 30206,DESSec-ParliamentaryBusiness@mod.uk,00163901,0.0,1.0,0,0,0,Procurement,DECS staff - reported on HOCS return,1.0
122,194481,N/D,SCS1,DECS Hd,"Director Exports and Commercial Strategy Head is responsible for external industry-facing commercial activities which require a deep, long term understanding of the industrial base and wider MOD commercial assurance and governance tasks in support of the Inves",Ministry of Defence,Ministry of Defence,Defence Equipment and Support,030 679 30206,DESSec-ParliamentaryBusiness@mod.uk,00163901,0.0,1.0,0,0,0,Procurement,DECS staff - reported on HOCS return,1.0
123,195021,N/D,SCS1,DES CDM-MatStratOrgD-Hd,Responsible for the Government Owned Contractor Operated (GOCO) Materiel Strategy workstream which is working to develop and agree with a commercial partner a proposed Value for Money GOCO solution to operate and transform the performance of DE&S.,Ministry of Defence,Ministry of Defence,Defence Equipment and Support,030 679 30206,DESSec-ParliamentaryBusiness@mod.uk,00168616,0.0,1.0,0,0,0,Programme and Project Management (PPM),,1.0
124,195370,"Firth, Neil",SCS2,Director LCS,The role of the Director of Logistics Commodities and Services (LCS) is to supply logistic commodities and services in order to meet prescribed Defence capabilities in the most cost effective manner.,Ministry of Defence,Ministry of Defence,Defence Equipment and Support,030 679 30206,DESSec-ParliamentaryBusiness@mod.uk,00170310,0.0,1.0,140000,144999,0,Operational Delivery,,1.0
125,195371,N/D,SCS1,DES LCS-ChangeMgt-Hd ,Logistic Commodities & Services Change Management Head,Ministry of Defence,Ministry of Defence,Defence Equipment and Support,030 679 30206,DESSec-ParliamentaryBusiness@mod.uk,00195370,0.0,1.0,0,0,0,Programme and Project Management (PPM),,1.0
126,195864,N/D,SCS1,DES CofM Land-LCS-JSC Fin-Hd,"Finance Head for Chief of Materiel Land, Joint Support Chain and Logistic Commodities & Services",Ministry of Defence,Ministry of Defence,Defence Equipment and Support,030 679 30206,DESSec-ParliamentaryBusiness@mod.uk,00170310,0.0,1.0,0,0,0,Finance,,1.0
127,197988,N/D,SCS1,DES Comrcl-WP1-Hd ,DES Head of Commercial Without Portfolio 1. Roving mandate for MOD Director Commercial to provide senior flexible resourcing to MOD-wide delivery of commercial solutions for defence objectives.,Ministry of Defence,Ministry of Defence,Defence Equipment and Support,030 679 30206,DESSec-ParliamentaryBusiness@mod.uk,00170772,0.0,1.0,0,0,0,Procurement,,1.0
128,198417,N/D,SCS1,DES Comrcl-WP2-Hd,DES Head of Commercial Without Portfolio 2. Roving mandate for MOD Director Commercial to provide senior flexible resourcing to MOD-wide delivery of commercial solutions for defence objectives.,Ministry of Defence,Ministry of Defence,Defence Equipment and Support,030 679 30206,DESSec-ParliamentaryBusiness@mod.uk,00170772,0.0,1.0,0,0,0,Procurement,,1.0
129,198424,"Morgan, Steven",SCS2,DES Comrcl -Ops Director,Director of DE&S Commercial Operations.,Ministry of Defence,Ministry of Defence,Defence Equipment and Support,030 679 30206,DESSec-ParliamentaryBusiness@mod.uk,00009000,0.0,1.0,155000,159999,0,Procurement,,1.0
130,1462808,N/D,OF-6,DES CST Fleet,"The Customer Support Team (Fleet) team is responsible for providing a 24/7 focal point for Defect Management and Crisis Response in support of Navy Command, providing business support to COM Fleet and developing and delivering the Navy Command Joint Business Agreement along with the associated monitoring and reporting of Maritime Performance and Risk.",Ministry of Defence,Ministry of Defence,Defence Equipment and Support,030 679 30206,DESSec-ParliamentaryBusiness@mod.uk,00170311,0.0,1.0,0,0,0,Military,,1.0
131,201481,N/D,SCS1,DES CofM Air-CFO-Hd,The Chief Finance Officer for the Air domain provides senior financial support to the Chief of Materiel (AIR) and acts as a financial focal point within DE&S for the Air domain,Ministry of Defence,Ministry of Defence,Defence Equipment and Support,030 679 30206,DESSec-ParliamentaryBusiness@mod.uk,00172101,0.0,1.0,0,0,0,Finance,,1.0
132,201482,N/D,SCS1,DES CofM Land-CFO-Hd,The Chief Finance Officer for the Land domain provides senior financial support for the Chief of Materiel (Land) and acts as a financial focal point within DE&S for the Land domain,Ministry of Defence,Ministry of Defence,Defence Equipment and Support,030 679 30206,DESSec-ParliamentaryBusiness@mod.uk,00170310,0.0,1.0,0,0,0,Finance,,1.0
133,201483,N/D,SCS1,DES CofM Fleet-CFO-Hd,The Chief Finance Officer for the Fleet domain provides senior financial support to the Chief of Materiel (Fleet) and acts as a financial focal point within DE&S for the Fleet domain,Ministry of Defence,Ministry of Defence,Defence Equipment and Support,030 679 30206,DESSec-ParliamentaryBusiness@mod.uk,00170311,0.0,1.0,0,0,0,Finance,,1.0
134,201484,N/D,SCS1,DES CofM JE-CFO-Hd,"The Chief Finance Officer for the Joint Enablers domain provides senior financial support for the Chief of Materiel (JE) and acts as a financial focal point within DE&S for Joint Enablers including Hels, ISTAR and ISS",Ministry of Defence,Ministry of Defence,Defence Equipment and Support,030 679 30206,DESSec-ParliamentaryBusiness@mod.uk,00003320,0.0,1.0,0,0,0,Finance,,1.0
135,202147,N/D,SCS1,DES HR-Hd Interim Structure,DE&S Head of recruitment,Ministry of Defence,Ministry of Defence,Defence Equipment and Support,030 679 30206,DESSec-ParliamentaryBusiness@mod.uk,00000001,0.0,1.0,0,0,0,Human Resources,,1.0
