,Post Unique Reference,Name,Grade,Job Title,Job/Team Function,Parent Department,Organisation,Unit,Contact Phone,Contact E-mail,Reports to Senior Post,Salary Cost of Reports (£),FTE,Actual Pay Floor (£),Actual Pay Ceiling (£),,Professional/Occupational Group,Notes,Valid?
0,CE,Archie Hughes,SCS2,Chief Executive of the DSG,Responsible to MOD Ministers + Parliament for providing corporate governance and leadership in delivering the strategic aims + objectives of the business,Ministry of Defence,Defence Support Group (DSG),Defence Support Group,T:01264383295,info@dsg.mod.uk,XX,304749.0,1.0,155000,159999,0,Other,Chief Executive,1
1,HRDIR,Jane Williams,SCS1,HR Director of the DSG,"Responsible to the Chief Executive for HR strategy + the full HR function as well as internal communications, parliamentary business + security policy",Ministry of Defence,Defence Support Group (DSG),Human Resources,T:01264383295,info@dsg.mod.uk,CE,1116100.0,1.0,0,0,0,Human Resources,,1
2,FINDIR,Steve Hall,SCS1,Finance Director,"Responsible to the Chief Executive for financial strategy, propriety + governance + delivery of high quality management information to the business",Ministry of Defence,Defence Support Group (DSG),Finance,T:01264383295,info@dsg.mod.uk,CE,1315000.0,1.0,0,0,0,Finance,,1
3,COMDIR,David Morgan,SCS1,Commercial Director,Responsible to the Chief Executive for all DSG's customer + supply chain activities across the various DSG business interests,Ministry of Defence,Defence Support Group (DSG),Commercial,T:01264383295,info@dsg.mod.uk,CE,2901831.0,1.0,0,0,0,Procurement,,1
4,COO,Geraint Spearing,SCS1,Chief Operating Officer,"Responsible to the Chief Executive for business streams + Determining the Operational Excellence Strategy of DSG. Also responsible for quality,environment, safety, health, information, services + facilities",Ministry of Defence,Defence Support Group (DSG),Operations,T:01264383295,info@dsg.mod.uk,CE,52985123.0,1.0,0,0,0,Operational Delivery,,1
5,STRDIR,Keith Norris,SCS1,Strategy Director,Responsible to the Chief Executive for DSG strategic direction + strategic business development. Provides the DSG lead on Ministerial matters. ,Ministry of Defence,Defence Support Group (DSG),Strategy,T:01264383295,info@dsg.mod.uk,CE,237900.0,1.0,0,0,0,Operational Research,Salary included in Junior Staff,1
