,Post Unique Reference,Name,Grade,Job Title,Job/Team Function,Parent Department,Organisation,Unit,Contact Phone,Contact E-mail,Reports to Senior Post,Salary Cost of Reports (£),FTE,Actual Pay Floor (£),Actual Pay Ceiling (£),,Professional/Occupational Group,Notes,Valid?
0,5,Andrew Wareing,SCS1,Chief Operating Officer,"Provide good customer service, Collective conciliation, Helpline",Department for Business Innovation and Skills,"Advisory, Conciliation and Arbitration Service",Delivery,N/D,pay_enquiries@acas.org.uk,1,19798032.0,1.0,0,0,0,Operational Delivery,,1
1,9,Susan Clews,SCS1,Directory of Strategy,Making sure Acas' expert knowledge influences government and is used by customers,Department for Business Innovation and Skills,"Advisory, Conciliation and Arbitration Service",Strategy,N/D,pay_enquiries@acas.org.uk,xx,1340034.0,0.89,0,0,0,Knowledge and Information Management (KIM),,1
2,1,Anne Sharpe,SCS2,Chief Executive,Leading the organisation during a period of major and continuous change. ,Department for Business Innovation and Skills,"Advisory, Conciliation and Arbitration Service","ICT, Finance, HR & Estates",02072103633,asharp@acas.org.uk,1,2251736.0,1.0,110000,114999,0,Operational Delivery,,1
3,20,N/D,SCS1,"Chief Executive, CAC","The Central Arbitration Committee (CAC) is an independent standing arbitration body. Its main role is concerned with requests for trade union recognition and de-recognition under the statutory procedures of Schedule A1 of the Employment Rights Act 1999. It also determines disclosure of information complaints under the Trade Union and Labour Relations (Consolidation) Act 1992 (Section 183), considers applications and complaints under the Information and Consultation of Employees Regulations 2004 and performs a similar role in relation to European Works Councils, and provides arbitration in trade disputes.",Department for Business Innovation and Skills,"Advisory, Conciliation and Arbitration Service",Central Arbitration Committee,N/D,pay_enquiries@acas.org.uk,1,267560.0,1.0,0,0,0,Operational Delivery,,1
4,1028,David Cockburn,SCS1,Certification Office,Certification Office - For trade unions & employers' associations,Department for Business Innovation and Skills,"Advisory, Conciliation and Arbitration Service",Certification Office,N/D,pay_enquiries@acas.org.uk,1,244099.0,0.6,0,0,0,Operational Delivery,,1
5,2013,N/D,SCS1,Knowledge Director,Information management and knowledge transfer,Department for Business Innovation and Skills,"Advisory, Conciliation and Arbitration Service",Strategy,N/D,pay_enquiries@acas.org.uk,1,0.0,0.01,0,0,0,Knowledge and Information Management (KIM),,1
